00:00.0 Host bridge: Advanced Micro Devices, Inc. [AMD] RS880 Host Bridge
00: 22 10 01 96 06 00 30 22 00 00 00 06 00 20 00 00
10: 00 00 00 00 00 00 00 00 00 00 00 00 00 00 00 00
20: 00 00 00 00 00 00 00 00 00 00 00 00 34 17 da 11
30: 00 00 00 00 c4 00 00 00 00 00 00 00 00 00 00 00
40: 08 9c 00 c0 c1 00 00 00 33 00 00 00 42 20 05 00
50: 34 17 da 11 08 40 00 90 08 10 05 00 08 00 05 00
60: 3c 00 00 00 00 00 00 00 00 02 20 00 0b c0 86 85
70: 00 00 00 00 00 00 00 00 00 00 00 00 00 00 00 20
80: 00 00 00 00 10 00 00 03 20 d4 00 00 33 26 00 00
90: 00 00 00 e0 7f 00 00 00 00 00 00 00 08 f8 7c d0
a0: 26 00 74 00 00 00 00 82 00 00 00 00 79 01 c0 02
b0: 00 00 00 00 00 00 00 00 00 00 00 00 00 00 00 00
c0: 00 00 00 80 08 54 80 01 20 00 11 11 d0 00 00 00
d0: 60 0c 75 1e 02 00 00 00 00 00 00 00 00 00 00 00
e0: 00 00 00 00 ff ff ff ff f0 00 00 00 20 00 00 00
f0: 00 00 00 00 00 80 80 00 08 00 00 e0 00 00 00 00

00:01.0 PCI bridge: Fujitsu Technology Solutions Device 9602
00: 34 17 02 96 07 00 30 02 00 00 04 06 00 20 01 00
10: 00 00 00 00 00 00 00 00 00 01 01 20 e1 e1 20 22
20: 40 ff 50 ff 01 fc f1 fd 00 00 00 00 00 00 00 00
30: 00 00 00 00 44 00 00 00 00 00 00 00 ff 00 18 00
40: 00 00 00 00 08 b0 03 a8 00 00 00 00 34 17 da 11
50: 00 00 00 00 00 00 00 00 00 00 00 00 00 00 00 00
60: 00 00 00 00 00 00 00 00 00 00 00 00 00 00 00 00
70: 00 00 00 00 00 00 00 00 00 00 00 00 00 00 00 00
80: 00 00 00 00 00 00 00 00 00 00 00 00 00 00 00 00
90: 00 00 00 00 00 00 00 00 00 00 00 00 00 00 00 00
a0: 00 00 00 00 00 00 00 00 00 00 00 00 00 00 00 00
b0: 0d 00 00 00 34 17 da 11 00 00 00 00 00 00 00 00
c0: 00 00 00 00 00 00 00 00 00 00 00 00 00 00 00 00
d0: 00 00 00 00 00 00 00 00 00 00 00 00 00 00 00 00
e0: 00 00 00 00 00 00 00 00 00 00 00 00 00 00 00 00
f0: 00 00 00 00 00 00 00 00 00 00 00 00 00 00 00 00

00:0a.0 PCI bridge: Advanced Micro Devices, Inc. [AMD] RS780/RS880 PCI to PCI bridge (PCIE port 5)
00: 22 10 09 96 07 04 10 00 00 00 04 06 10 00 01 00
10: 00 00 00 00 00 00 00 00 00 02 02 00 f1 01 00 20
20: 60 ff 60 ff f1 ff 01 00 00 00 00 00 00 00 00 00
30: 00 00 00 00 50 00 00 00 00 00 00 00 0b 01 10 00
40: 00 00 00 00 00 00 00 00 00 00 00 00 00 00 00 00
50: 01 58 03 c8 00 00 00 00 10 a0 42 01 20 80 00 00
60: 00 08 00 00 12 0c 30 01 40 00 11 70 80 25 54 00
70: 00 00 48 01 10 00 01 00 00 00 00 00 00 00 00 00
80: 00 00 00 00 00 00 00 00 42 00 01 00 00 00 00 00
90: 00 00 00 00 00 00 00 00 00 00 00 00 00 00 00 00
a0: 05 b0 01 00 0c f0 ef fe c1 41 00 00 00 00 00 00
b0: 0d b8 00 00 34 17 da 11 08 00 03 a8 00 00 00 00
c0: 00 00 00 00 00 00 00 00 00 00 00 00 00 00 00 00
d0: 00 00 00 00 00 00 00 00 00 00 00 00 00 00 00 00
e0: 00 00 00 00 ff ff ff ff 00 00 00 00 00 00 00 00
f0: 00 00 00 00 00 00 00 00 00 00 00 00 00 00 00 00

00:11.0 SATA controller: Advanced Micro Devices, Inc. [AMD/ATI] SB7x0/SB8x0/SB9x0 SATA Controller [AHCI mode]
00: 02 10 91 43 07 00 30 02 00 01 06 01 00 20 00 00
10: 41 f0 00 00 31 f0 00 00 21 f0 00 00 11 f0 00 00
20: 01 f0 00 00 00 b0 70 ff 00 00 00 00 34 17 9a 11
30: 00 00 00 00 60 00 00 00 00 00 00 00 07 01 00 00
40: 10 00 80 00 01 00 10 00 c0 bf 00 00 00 00 00 00
50: 05 70 86 00 00 00 00 00 00 00 00 00 00 00 00 00
60: 01 70 22 00 00 00 00 00 00 00 00 00 00 00 00 00
70: 12 00 10 00 0f 00 00 00 98 01 00 00 17 78 00 00
80: 00 00 00 00 06 00 00 2c 16 80 b4 01 16 80 b4 01
90: 16 80 b4 01 16 80 b4 01 16 80 b4 01 16 80 b4 01
a0: 7a a0 7a a0 7a a0 7a a0 7a a0 7a a0 00 00 00 00
b0: 00 00 00 00 00 00 00 00 00 00 00 00 00 00 00 00
c0: 00 00 00 00 00 00 00 00 00 00 00 00 00 00 00 00
d0: 00 00 00 00 00 00 00 00 00 00 00 00 00 20 00 00
e0: 80 00 00 00 00 00 00 00 00 00 00 00 00 00 00 00
f0: 00 00 00 00 00 00 00 00 00 00 00 00 00 00 00 00

00:12.0 USB controller: Advanced Micro Devices, Inc. [AMD/ATI] SB7x0/SB8x0/SB9x0 USB OHCI0 Controller
00: 02 10 97 43 07 00 a0 02 00 10 03 0c 10 20 80 00
10: 00 a0 70 ff 00 00 00 00 00 00 00 00 00 00 00 00
20: 00 00 00 00 00 00 00 00 00 00 00 00 34 17 9a 11
30: 00 00 00 00 00 00 00 00 00 00 00 00 0b 01 00 00
40: 80 03 00 00 11 00 00 00 00 00 00 00 00 00 00 00
50: 40 13 03 f6 00 00 00 00 ff ff ff ff 00 00 00 00
60: 00 00 00 00 00 00 00 00 00 00 00 00 00 00 00 00
70: 00 00 00 00 ff 00 00 80 00 00 00 00 00 00 00 00
80: 00 00 00 00 00 00 00 00 00 00 00 00 00 00 00 00
90: 00 00 00 00 00 00 00 00 00 00 00 00 00 00 00 00
a0: 00 00 00 00 00 00 00 00 00 00 00 00 00 00 00 00
b0: 00 00 00 00 00 00 00 00 00 00 00 00 00 00 00 00
c0: 00 00 00 00 00 00 00 00 00 00 00 00 00 00 00 00
d0: 00 00 00 00 00 00 00 00 00 00 00 00 00 00 00 00
e0: 00 00 00 00 00 00 00 00 00 00 00 00 00 00 00 00
f0: 00 00 00 00 00 00 00 00 00 00 00 00 00 00 00 00

00:12.1 USB controller: Advanced Micro Devices, Inc. [AMD/ATI] SB7x0 USB OHCI1 Controller
00: 02 10 98 43 07 00 a0 02 00 10 03 0c 10 20 00 00
10: 00 90 70 ff 00 00 00 00 00 00 00 00 00 00 00 00
20: 00 00 00 00 00 00 00 00 00 00 00 00 34 17 9a 11
30: 00 00 00 00 00 00 00 00 00 00 00 00 0b 01 00 00
40: 00 00 00 00 00 00 00 00 00 00 00 00 00 00 00 00
50: 00 00 00 00 00 00 00 00 00 00 00 00 00 00 00 00
60: 00 00 00 00 00 00 00 00 00 00 00 00 00 00 00 00
70: 00 00 00 00 00 00 00 00 00 00 00 00 00 00 00 00
80: 00 00 00 00 00 00 00 00 00 00 00 00 00 00 00 00
90: 00 00 00 00 00 00 00 00 00 00 00 00 00 00 00 00
a0: 00 00 00 00 00 00 00 00 00 00 00 00 00 00 00 00
b0: 00 00 00 00 00 00 00 00 00 00 00 00 00 00 00 00
c0: 00 00 00 00 00 00 00 00 00 00 00 00 00 00 00 00
d0: 00 00 00 00 00 00 00 00 00 00 00 00 00 00 00 00
e0: 00 00 00 00 00 00 00 00 00 00 00 00 00 00 00 00
f0: 00 00 00 00 00 00 00 00 00 00 00 00 00 00 00 00

00:12.2 USB controller: Advanced Micro Devices, Inc. [AMD/ATI] SB7x0/SB8x0/SB9x0 USB EHCI Controller
00: 02 10 96 43 17 00 b0 02 00 20 03 0c 10 20 00 00
10: 00 80 70 ff 00 00 00 00 00 00 00 00 00 00 00 00
20: 00 00 00 00 00 00 00 00 00 00 00 00 34 17 9a 11
30: 00 00 00 00 c0 00 00 00 00 00 00 00 0a 02 00 00
40: 00 00 00 00 00 00 00 00 00 00 00 00 00 00 00 00
50: d8 01 9e 80 00 00 00 00 00 00 00 00 00 00 00 00
60: 20 20 00 00 00 00 00 00 00 00 00 00 00 00 00 00
70: 00 00 00 00 00 00 00 00 00 00 00 00 00 00 00 00
80: 00 00 00 00 00 00 00 00 00 00 00 00 00 00 00 00
90: 00 00 00 00 00 00 00 00 00 00 00 00 00 00 00 00
a0: 01 00 00 00 00 00 08 40 00 00 00 00 00 00 00 00
b0: 00 00 00 00 00 00 00 00 00 00 00 00 00 00 00 00
c0: 01 e4 02 7e 00 00 40 00 00 00 00 00 00 00 00 00
d0: 00 00 00 00 00 00 00 00 00 00 00 00 00 00 00 00
e0: 00 00 00 00 0a 00 e0 20 00 00 00 00 00 00 00 00
f0: 00 00 00 00 00 00 00 00 00 00 00 00 00 00 00 00

00:13.0 USB controller: Advanced Micro Devices, Inc. [AMD/ATI] SB7x0/SB8x0/SB9x0 USB OHCI0 Controller
00: 02 10 97 43 07 00 a0 02 00 10 03 0c 10 20 80 00
10: 00 70 70 ff 00 00 00 00 00 00 00 00 00 00 00 00
20: 00 00 00 00 00 00 00 00 00 00 00 00 34 17 9a 11
30: 00 00 00 00 00 00 00 00 00 00 00 00 0b 01 00 00
40: 80 03 00 00 11 00 00 00 00 00 00 00 00 00 00 00
50: 40 13 03 f6 00 00 00 00 ff ff ff ff 00 00 00 00
60: 00 00 00 00 00 00 00 00 00 00 00 00 00 00 00 00
70: 00 00 00 00 ff 00 00 80 00 00 00 00 00 00 00 00
80: 00 00 00 00 00 00 00 00 00 00 00 00 00 00 00 00
90: 00 00 00 00 00 00 00 00 00 00 00 00 00 00 00 00
a0: 00 00 00 00 00 00 00 00 00 00 00 00 00 00 00 00
b0: 00 00 00 00 00 00 00 00 00 00 00 00 00 00 00 00
c0: 00 00 00 00 00 00 00 00 00 00 00 00 00 00 00 00
d0: 00 00 00 00 00 00 00 00 00 00 00 00 00 00 00 00
e0: 00 00 00 00 00 00 00 00 00 00 00 00 00 00 00 00
f0: 00 00 00 00 00 00 00 00 00 00 00 00 00 00 00 00

00:13.1 USB controller: Advanced Micro Devices, Inc. [AMD/ATI] SB7x0 USB OHCI1 Controller
00: 02 10 98 43 07 00 a0 02 00 10 03 0c 10 20 00 00
10: 00 60 70 ff 00 00 00 00 00 00 00 00 00 00 00 00
20: 00 00 00 00 00 00 00 00 00 00 00 00 34 17 9a 11
30: 00 00 00 00 00 00 00 00 00 00 00 00 0b 01 00 00
40: 00 00 00 00 00 00 00 00 00 00 00 00 00 00 00 00
50: 00 00 00 00 00 00 00 00 00 00 00 00 00 00 00 00
60: 00 00 00 00 00 00 00 00 00 00 00 00 00 00 00 00
70: 00 00 00 00 00 00 00 00 00 00 00 00 00 00 00 00
80: 00 00 00 00 00 00 00 00 00 00 00 00 00 00 00 00
90: 00 00 00 00 00 00 00 00 00 00 00 00 00 00 00 00
a0: 00 00 00 00 00 00 00 00 00 00 00 00 00 00 00 00
b0: 00 00 00 00 00 00 00 00 00 00 00 00 00 00 00 00
c0: 00 00 00 00 00 00 00 00 00 00 00 00 00 00 00 00
d0: 00 00 00 00 00 00 00 00 00 00 00 00 00 00 00 00
e0: 00 00 00 00 00 00 00 00 00 00 00 00 00 00 00 00
f0: 00 00 00 00 00 00 00 00 00 00 00 00 00 00 00 00

00:13.2 USB controller: Advanced Micro Devices, Inc. [AMD/ATI] SB7x0/SB8x0/SB9x0 USB EHCI Controller
00: 02 10 96 43 17 00 b0 02 00 20 03 0c 10 20 00 00
10: 00 50 70 ff 00 00 00 00 00 00 00 00 00 00 00 00
20: 00 00 00 00 00 00 00 00 00 00 00 00 34 17 9a 11
30: 00 00 00 00 c0 00 00 00 00 00 00 00 0a 02 00 00
40: 00 00 00 00 00 00 00 00 00 00 00 00 00 00 00 00
50: d8 01 9e 80 00 00 00 00 00 00 00 00 00 00 00 00
60: 20 20 00 00 00 00 00 00 00 00 00 00 00 00 00 00
70: 00 00 00 00 00 00 00 00 00 00 00 00 00 00 00 00
80: 00 00 00 00 00 00 00 00 00 00 00 00 00 00 00 00
90: 00 00 00 00 00 00 00 00 00 00 00 00 00 00 00 00
a0: 01 00 00 00 00 00 00 40 00 00 00 00 00 00 00 00
b0: 00 00 00 00 00 00 00 00 00 00 00 00 00 00 00 00
c0: 01 e4 02 7e 00 00 40 00 00 00 00 00 00 00 00 00
d0: 00 00 00 00 00 00 00 00 00 00 00 00 00 00 00 00
e0: 00 00 00 00 0a 00 e0 20 00 00 00 00 00 00 00 00
f0: 00 00 00 00 00 00 00 00 00 00 00 00 00 00 00 00

00:14.0 SMBus: Advanced Micro Devices, Inc. [AMD/ATI] SBx00 SMBus Controller (rev 3c)
00: 02 10 85 43 03 04 30 02 3c 00 05 0c 00 00 80 00
10: 00 00 00 00 00 00 00 00 00 00 00 00 00 00 00 00
20: 00 00 00 00 00 00 00 00 00 00 00 00 34 17 9a 11
30: 00 00 00 00 b0 00 00 00 00 00 00 00 00 00 00 00
40: 44 e9 00 fc 00 00 00 00 0f ff 00 00 00 00 00 80
50: f0 01 f0 00 f0 00 f0 00 21 0b f0 0f 80 00 10 00
60: 01 00 a4 20 bf fc 9e 03 ff 90 00 00 20 00 00 00
70: 00 00 00 00 08 00 c0 fe ff 6f 00 00 00 00 f0 06
80: ec 0a f0 0f 00 00 00 00 00 00 00 00 00 00 00 00
90: 01 0b 00 00 a9 ce ff 00 00 00 00 00 00 00 00 00
a0: 01 00 fe ff e1 10 f0 09 00 ff 08 02 06 51 68 18
b0: 08 00 02 a8 00 00 d0 fe 00 00 00 00 fe 0f 08 1a
c0: ff ff ff ff 00 00 00 00 00 00 00 00 00 00 00 00
d0: 00 00 01 00 00 00 00 00 00 00 00 00 00 00 00 00
e0: 20 99 00 00 00 00 00 00 00 00 00 00 00 00 00 00
f0: d8 0c 00 00 00 00 44 00 00 00 00 00 aa 00 30 00

00:14.2 Audio device: Advanced Micro Devices, Inc. [AMD/ATI] SBx00 Azalia (Intel HDA)
00: 02 10 83 43 06 00 10 04 00 00 03 04 10 20 00 00
10: 04 00 70 ff 00 00 00 00 00 00 00 00 00 00 00 00
20: 00 00 00 00 00 00 00 00 00 00 00 00 34 17 9c 11
30: 00 00 00 00 50 00 00 00 00 00 00 00 0b 01 00 00
40: 00 00 02 00 01 00 00 00 00 00 00 00 01 00 00 00
50: 01 00 42 c8 00 00 00 00 00 00 00 00 00 00 00 00
60: 05 00 80 00 00 00 00 00 00 00 00 00 00 00 00 00
70: 00 00 00 00 00 00 00 00 00 00 00 00 00 00 00 00
80: 00 00 00 00 00 00 00 00 00 00 00 00 00 00 00 00
90: 00 00 00 00 00 00 00 00 00 00 00 00 00 00 00 00
a0: 00 00 00 00 00 00 00 00 00 00 00 00 00 00 00 00
b0: 00 00 00 00 00 00 00 00 00 00 00 00 00 00 00 00
c0: 00 00 00 00 00 00 00 00 00 00 00 00 00 00 00 00
d0: 00 00 00 00 00 00 00 00 00 00 00 00 00 00 00 00
e0: 00 00 00 00 00 00 00 00 00 00 00 00 00 00 00 00
f0: 00 00 00 00 00 00 00 00 00 00 00 00 00 00 00 00

00:14.3 ISA bridge: Advanced Micro Devices, Inc. [AMD/ATI] SB7x0/SB8x0/SB9x0 LPC host controller
00: 02 10 9d 43 0f 00 20 02 00 00 01 06 00 00 80 00
10: 00 00 00 00 00 00 00 00 00 00 00 00 00 00 00 00
20: 00 00 00 00 00 00 00 00 00 00 00 00 34 17 9a 11
30: 00 00 00 00 00 00 00 00 00 00 00 00 00 00 00 00
40: 04 00 00 00 40 ff 03 f3 07 ff 4a 00 00 00 00 00
50: 00 00 00 00 00 00 00 00 00 00 00 00 00 00 00 00
60: 00 00 00 00 80 04 00 00 0e 00 0f 00 80 ff ff ff
70: 67 45 23 00 00 00 00 00 1c 00 00 00 05 0a 00 00
80: 08 00 03 a8 00 00 00 00 00 00 00 00 00 00 00 00
90: 00 00 00 00 00 00 00 00 00 00 00 08 00 00 00 00
a0: 02 00 c1 fe 2f 00 00 00 00 00 00 00 00 00 00 00
b0: 00 00 00 00 00 00 00 00 00 00 00 e9 f2 ff 00 00
c0: 00 00 00 00 00 00 08 00 f7 ff ff ff 00 00 00 78
d0: 00 ff ff 00 00 00 00 ff ff ff ff 00 00 00 00 0c
e0: 00 00 00 00 00 00 00 00 00 00 00 00 00 00 00 00
f0: 00 00 00 00 00 00 00 00 00 00 00 00 00 00 00 00

00:14.4 PCI bridge: Advanced Micro Devices, Inc. [AMD/ATI] SBx00 PCI to PCI Bridge
00: 02 10 84 43 27 00 a0 02 00 01 04 06 00 40 81 00
10: 00 00 00 00 00 00 00 00 00 03 03 40 f0 00 80 22
20: f0 ff 00 00 f0 ff 00 00 00 00 00 00 00 00 00 00
30: 00 00 00 00 00 00 00 00 00 00 00 00 00 00 10 00
40: 26 00 3c ff 00 00 00 00 0c 0f 3d d1 00 01 00 00
50: 01 00 00 00 08 00 03 a8 00 00 00 00 85 00 ff ff
60: ca 0e 17 00 ba d8 10 00 00 00 00 00 00 00 00 00
70: 00 00 00 00 00 00 00 00 00 00 00 00 00 00 00 00
80: 00 00 00 00 00 00 00 00 00 00 00 00 00 00 00 00
90: 00 00 00 00 00 00 00 00 00 00 00 00 00 00 00 00
a0: 00 00 00 00 00 00 00 00 00 00 00 00 00 00 00 00
b0: 00 00 00 00 00 00 00 00 00 00 00 00 00 00 00 00
c0: 00 00 00 00 00 00 00 00 00 00 00 00 00 00 00 00
d0: 00 00 00 00 00 00 00 00 00 00 00 00 01 00 02 06
e0: 00 00 80 00 00 00 00 00 00 00 00 00 00 00 00 00
f0: 00 00 00 00 00 00 00 00 00 00 00 00 00 00 00 00

00:14.5 USB controller: Advanced Micro Devices, Inc. [AMD/ATI] SB7x0/SB8x0/SB9x0 USB OHCI2 Controller
00: 02 10 99 43 07 00 a0 02 00 10 03 0c 10 20 00 00
10: 00 40 70 ff 00 00 00 00 00 00 00 00 00 00 00 00
20: 00 00 00 00 00 00 00 00 00 00 00 00 34 17 9a 11
30: 00 00 00 00 00 00 00 00 00 00 00 00 0b 03 00 00
40: 80 01 00 00 11 00 00 00 00 00 00 00 00 00 00 00
50: 40 13 1f f6 00 00 00 00 ff ff ff ff 00 00 00 00
60: 00 00 00 00 00 00 00 00 00 00 00 00 00 00 00 00
70: 00 00 00 00 ff 00 00 80 00 00 00 00 00 00 00 00
80: 00 00 00 00 00 00 00 00 00 00 00 00 00 00 00 00
90: 00 00 00 00 00 00 00 00 00 00 00 00 00 00 00 00
a0: 00 00 00 00 00 00 00 00 00 00 00 00 00 00 00 00
b0: 00 00 00 00 00 00 00 00 00 00 00 00 00 00 00 00
c0: 00 00 00 00 00 00 00 00 00 00 00 00 00 00 00 00
d0: 00 00 00 00 00 00 00 00 00 00 00 00 00 00 00 00
e0: 00 00 00 00 00 00 00 00 00 00 00 00 00 00 00 00
f0: 00 00 00 00 00 00 00 00 00 00 00 00 00 00 00 00

00:18.0 Host bridge: Advanced Micro Devices, Inc. [AMD] Family 15h Processor Function 0
00: 22 10 00 16 00 00 10 00 00 00 00 06 00 00 80 00
10: 00 00 00 00 00 00 00 00 00 00 00 00 00 00 00 00
20: 00 00 00 00 00 00 00 00 00 00 00 00 00 00 00 00
30: 00 00 00 00 80 00 00 00 00 00 00 00 00 00 00 00
40: 01 02 04 00 01 02 04 00 01 02 04 00 01 02 04 00
50: 01 02 04 00 01 02 04 00 01 02 04 00 01 02 04 00
60: 00 00 07 00 e0 00 00 00 00 a8 2e 02 00 fe 80 00
70: 00 00 00 00 00 00 00 00 00 00 00 00 00 00 00 00
80: 08 00 01 21 20 a0 11 11 60 0c f5 ff 13 00 00 00
90: ee 02 84 80 00 00 01 00 07 00 00 00 00 00 00 00
a0: 00 00 00 00 00 00 00 00 00 00 00 00 00 00 00 00
b0: 00 00 00 00 00 00 00 00 00 00 00 00 00 00 00 00
c0: 00 00 00 00 00 00 00 00 00 00 00 00 00 00 00 00
d0: 00 00 00 00 00 00 00 00 00 00 00 00 00 00 00 00
e0: 00 00 00 00 00 00 00 00 00 00 00 00 00 00 00 00
f0: 00 00 00 00 00 00 00 00 00 00 00 00 00 00 00 00

00:18.1 Host bridge: Advanced Micro Devices, Inc. [AMD] Family 15h Processor Function 1
00: 22 10 01 16 00 00 00 00 00 00 00 06 00 00 80 00
10: 00 00 00 00 00 00 00 00 00 00 00 00 00 00 00 00
20: 00 00 00 00 00 00 00 00 00 00 00 00 00 00 00 00
30: 00 00 00 00 00 00 00 00 00 00 00 00 00 00 00 00
40: 03 00 00 00 00 00 1e 08 00 00 00 00 01 00 00 00
50: 00 00 00 00 02 00 00 00 00 00 00 00 03 00 00 00
60: 00 00 00 00 04 00 00 00 00 00 00 00 05 00 00 00
70: 00 00 00 00 06 00 00 00 00 00 00 00 07 00 00 00
80: 00 00 00 00 00 00 00 00 00 00 00 00 00 00 00 00
90: 03 00 e0 00 80 ff ef 00 03 00 f0 00 00 ff fb 00
a0: 03 00 fc 00 80 ff fd 00 03 00 fe 00 00 3f ff 00
b0: 03 40 ff 00 80 5f ff 00 03 60 ff 00 00 7f ff 00
c0: 13 e0 00 00 00 f0 00 00 00 00 00 00 00 00 00 00
d0: 00 00 00 00 00 00 00 00 00 00 00 00 00 00 00 00
e0: 03 00 00 1f 00 00 00 00 00 00 00 00 00 00 00 00
f0: 03 20 00 e0 01 00 00 00 00 00 00 00 00 00 00 00

00:18.2 Host bridge: Advanced Micro Devices, Inc. [AMD] Family 15h Processor Function 2
00: 22 10 02 16 00 00 00 00 00 00 00 06 00 00 80 00
10: 00 00 00 00 00 00 00 00 00 00 00 00 00 00 00 00
20: 00 00 00 00 00 00 00 00 00 00 00 00 00 00 00 00
30: 00 00 00 00 00 00 00 00 00 00 00 00 00 00 00 00
40: 01 00 00 00 09 01 00 00 01 02 00 00 09 03 00 00
50: 00 00 00 00 00 00 00 00 00 00 00 00 00 00 00 00
60: e0 3c f8 03 e0 3c f8 03 00 00 00 00 00 00 00 00
70: 00 00 00 00 00 00 00 00 00 00 02 00 08 05 64 18
80: aa 00 00 00 04 00 80 00 00 00 00 30 00 00 02 00
90: 00 00 01 0b 8e 88 59 0f 07 40 0f 8d 00 00 00 00
a0: 20 02 1f 00 00 00 00 00 00 00 40 00 00 00 00 00
b0: e6 c1 22 d7 b1 00 00 00 28 02 43 38 5c 6d 25 79
c0: 00 00 00 00 00 00 00 00 00 00 00 00 00 00 00 00
d0: 10 71 8d 2a 4b 5e 1f 2c ee 08 43 ab e9 38 12 4e
e0: 32 c6 70 53 8d 56 1a f9 37 66 27 bf ca 24 96 51
f0: 00 00 00 00 00 00 00 00 81 78 51 46 41 55 15 00

00:18.3 Host bridge: Advanced Micro Devices, Inc. [AMD] Family 15h Processor Function 3
00: 22 10 03 16 00 00 10 00 00 00 00 06 00 00 80 00
10: 00 00 00 00 00 00 00 00 00 00 00 00 00 00 00 00
20: 00 00 00 00 00 00 00 00 00 00 00 00 00 00 00 00
30: 00 00 00 00 f0 00 00 00 00 00 00 00 00 00 00 00
40: ff ff ff ff 44 00 b0 4a 00 00 00 00 00 00 00 00
50: 00 00 00 00 00 00 00 00 00 00 00 00 00 00 00 00
60: 00 00 00 00 05 00 24 66 00 00 00 60 52 00 01 10
70: 55 11 17 10 11 21 17 00 12 0e 20 00 16 0f 0d 04
80: 81 e2 0b e2 e2 00 e2 01 08 00 81 00 00 60 40 00
90: 43 00 00 00 6a 00 00 00 00 35 7c 01 00 00 00 00
a0: 00 0c 14 a0 ef 0f 80 34 00 00 00 d0 00 00 00 00
b0: 00 00 00 00 00 00 00 00 00 00 00 00 30 40 05 00
c0: 00 00 00 00 00 00 00 00 00 00 00 00 00 00 00 00
d0: 00 00 00 00 18 2f 81 c8 10 00 00 03 36 66 47 05
e0: 00 00 00 00 20 00 00 00 18 4f 07 02 00 00 00 00
f0: 0f 00 10 00 00 00 00 00 00 00 00 00 12 0f 60 00

00:18.4 Host bridge: Advanced Micro Devices, Inc. [AMD] Family 15h Processor Function 4
00: 22 10 04 16 00 00 00 00 00 00 00 06 00 00 80 00
10: 00 00 00 00 00 00 00 00 00 00 00 00 00 00 00 00
20: 00 00 00 00 00 00 00 00 00 00 00 00 00 00 00 00
30: 00 00 00 00 00 00 00 00 00 00 00 00 00 00 00 00
40: 00 00 00 00 00 00 00 00 00 00 00 00 00 00 00 00
50: 00 00 00 00 ff ff 00 00 00 00 00 00 00 00 00 00
60: 00 00 00 00 00 00 00 00 00 00 00 00 00 00 00 00
70: 00 00 00 00 00 00 00 00 00 00 00 00 00 00 00 00
80: 00 00 00 00 00 00 00 00 00 00 00 00 00 00 00 00
90: 00 00 00 00 00 00 00 00 00 00 00 00 00 00 00 00
a0: 00 00 00 00 00 00 00 00 00 00 00 00 00 00 00 00
b0: 00 00 00 00 00 00 00 00 00 00 00 00 00 00 00 00
c0: 00 00 00 00 00 00 00 00 00 00 00 00 00 00 00 00
d0: 00 00 00 00 00 00 00 00 00 00 00 00 00 00 00 00
e0: 00 00 00 00 00 00 00 00 00 00 00 00 00 00 00 00
f0: 00 00 00 00 00 00 00 00 00 00 00 00 00 00 00 00

00:18.5 Host bridge: Advanced Micro Devices, Inc. [AMD] Family 15h Processor Function 5
00: 22 10 05 16 00 00 00 00 00 00 00 06 00 00 80 00
10: 00 00 00 00 00 00 00 00 00 00 00 00 00 00 00 00
20: 00 00 00 00 00 00 00 00 00 00 00 00 00 00 00 00
30: 00 00 00 00 00 00 00 00 00 00 00 00 00 00 00 00
40: 00 00 00 00 00 00 00 00 00 00 00 00 00 00 00 00
50: 00 00 00 00 00 00 00 00 00 00 00 00 00 00 00 00
60: 00 00 00 00 00 00 00 00 00 00 00 00 00 00 00 00
70: 00 00 00 00 00 00 00 00 00 00 00 00 00 00 00 00
80: 0f 00 0f 00 07 30 16 16 00 40 00 00 00 00 00 00
90: 00 00 00 00 00 00 00 00 00 00 00 00 00 00 00 00
a0: 00 00 00 00 00 00 00 00 00 00 00 00 00 00 00 00
b0: 28 23 00 00 ac 17 00 00 00 00 00 00 eb 05 00 00
c0: 00 5c 00 00 80 8d 00 00 30 0e 00 00 b2 02 00 00
d0: c8 61 00 00 07 7f 00 00 07 7f 00 00 00 00 00 00
e0: d9 83 0e 00 00 00 00 00 ae 00 2f 01 71 00 02 00
f0: 00 00 00 00 00 00 00 00 00 00 00 00 00 00 00 00

01:05.0 VGA compatible controller: Advanced Micro Devices, Inc. [AMD/ATI] RS880 [Radeon HD 4250]
00: 02 10 15 97 07 00 10 00 00 00 00 03 10 00 80 00
10: 08 00 00 fc 01 e0 00 00 00 00 50 ff 00 00 00 00
20: 00 00 00 00 00 00 40 ff 00 00 00 00 34 17 da 11
30: 00 00 00 00 50 00 00 00 00 00 00 00 0b 01 00 00
40: 00 00 00 00 00 00 00 00 00 00 00 00 34 17 da 11
50: 01 a0 03 06 00 00 00 00 10 a0 12 00 a0 8f 00 00
60: 10 08 0a 00 01 0d 00 00 00 00 01 11 00 00 00 00
70: 00 00 00 00 00 00 00 00 00 00 00 00 1f 00 00 00
80: 00 00 00 00 00 00 00 00 01 00 01 00 00 00 00 00
90: 00 00 00 00 00 00 00 00 00 00 00 00 00 00 00 00
a0: 05 00 80 00 00 00 00 00 00 00 00 00 00 00 00 00
b0: 00 00 00 00 00 00 00 00 00 00 00 00 00 00 00 00
c0: 00 00 00 00 00 00 00 00 00 00 00 00 00 00 00 00
d0: 00 00 00 00 00 00 00 00 00 00 00 00 00 00 00 00
e0: 00 00 00 00 00 00 00 00 00 00 00 00 00 00 00 00
f0: 00 00 00 00 00 00 00 00 00 00 00 00 00 00 00 00

01:05.1 Audio device: Advanced Micro Devices, Inc. [AMD/ATI] RS880 HDMI Audio [Radeon HD 4200 Series]
00: 02 10 0f 97 07 00 10 00 00 00 03 04 10 00 80 00
10: 00 00 51 ff 00 00 00 00 00 00 00 00 00 00 00 00
20: 00 00 00 00 00 00 00 00 00 00 00 00 34 17 da 11
30: 00 00 00 00 50 00 00 00 00 00 00 00 0a 02 00 00
40: 00 00 00 00 00 00 00 00 00 00 00 00 34 17 da 11
50: 01 a0 03 06 00 00 00 00 10 a0 12 00 a0 8f 00 00
60: 10 08 0a 00 01 0d 00 00 00 00 01 11 00 00 00 00
70: 00 00 00 00 00 00 00 00 00 00 00 00 1f 00 00 00
80: 00 00 00 00 00 00 00 00 00 00 01 00 00 00 00 00
90: 00 00 00 00 00 00 00 00 00 00 00 00 00 00 00 00
a0: 05 00 80 00 00 00 00 00 00 00 00 00 00 00 00 00
b0: 00 00 00 00 00 00 00 00 00 00 00 00 00 00 00 00
c0: 00 00 00 00 00 00 00 00 00 00 00 00 00 00 00 00
d0: 00 00 00 00 00 00 00 00 00 00 00 00 00 00 00 00
e0: 00 00 00 00 00 00 00 00 00 00 00 00 00 00 00 00
f0: 00 00 00 00 00 00 00 00 00 00 00 00 00 00 00 00

02:00.0 Ethernet controller: Broadcom Inc. and subsidiaries NetLink BCM57780 Gigabit Ethernet PCIe (rev 01)
00: e4 14 92 16 06 04 10 00 01 00 00 02 10 00 00 00
10: 04 00 60 ff 00 00 00 00 00 00 00 00 00 00 00 00
20: 00 00 00 00 00 00 00 00 00 00 00 00 34 17 aa 11
30: 00 00 00 00 48 00 00 00 00 00 00 00 0b 01 00 00
40: 00 00 00 00 00 00 00 00 01 60 03 c0 08 20 00 08
50: 05 cc 81 00 0c 10 e0 fe 00 00 00 00 52 41 00 00
60: 09 50 6c 00 ff ff e4 ff 98 02 01 f0 00 00 18 76
70: f2 10 00 00 00 00 00 00 00 00 00 00 00 00 00 00
80: e4 14 92 16 1a 00 00 00 34 00 13 04 82 50 08 20
90: 19 92 00 01 00 00 00 50 00 00 00 00 8b 01 00 00
a0: 00 00 00 00 c3 00 00 00 00 00 00 00 b0 01 00 00
b0: 00 00 00 00 00 00 00 fd 00 00 00 00 01 00 78 57
c0: 00 00 00 00 e4 14 92 16 0e 00 00 00 10 00 02 00
d0: a0 8f 2c 01 00 20 10 00 11 cc 06 00 40 00 11 10
e0: 00 00 00 00 00 00 00 00 00 00 00 00 00 00 00 00
f0: 1f 00 00 00 00 00 00 00 00 00 00 00 00 00 00 00

