00:00.0 Host bridge: Advanced Micro Devices, Inc. [AMD] RS880 Host Bridge
00: 22 10 01 96 06 00 30 22 00 00 00 06 00 20 00 00
10: 00 00 00 00 00 00 00 00 00 00 00 00 00 00 00 00
20: 00 00 00 00 00 00 00 00 00 00 00 00 34 17 da 11
30: 00 00 00 00 c4 00 00 00 00 00 00 00 00 00 00 00

00:01.0 PCI bridge: Fujitsu Technology Solutions Device 9602
00: 34 17 02 96 07 00 30 02 00 00 04 06 00 20 01 00
10: 00 00 00 00 00 00 00 00 00 01 01 20 e1 e1 20 22
20: 40 ff 50 ff 01 fc f1 fd 00 00 00 00 00 00 00 00
30: 00 00 00 00 44 00 00 00 00 00 00 00 ff 00 18 00

00:0a.0 PCI bridge: Advanced Micro Devices, Inc. [AMD] RS780/RS880 PCI to PCI bridge (PCIE port 5)
00: 22 10 09 96 07 04 10 00 00 00 04 06 10 00 01 00
10: 00 00 00 00 00 00 00 00 00 02 02 00 f1 01 00 20
20: 60 ff 60 ff f1 ff 01 00 00 00 00 00 00 00 00 00
30: 00 00 00 00 50 00 00 00 00 00 00 00 0b 01 10 00

00:11.0 SATA controller: Advanced Micro Devices, Inc. [AMD/ATI] SB7x0/SB8x0/SB9x0 SATA Controller [AHCI mode]
00: 02 10 91 43 07 00 30 02 00 01 06 01 00 20 00 00
10: 41 f0 00 00 31 f0 00 00 21 f0 00 00 11 f0 00 00
20: 01 f0 00 00 00 b0 70 ff 00 00 00 00 34 17 9a 11
30: 00 00 00 00 60 00 00 00 00 00 00 00 07 01 00 00

00:12.0 USB controller: Advanced Micro Devices, Inc. [AMD/ATI] SB7x0/SB8x0/SB9x0 USB OHCI0 Controller
00: 02 10 97 43 07 00 a0 02 00 10 03 0c 10 20 80 00
10: 00 a0 70 ff 00 00 00 00 00 00 00 00 00 00 00 00
20: 00 00 00 00 00 00 00 00 00 00 00 00 34 17 9a 11
30: 00 00 00 00 00 00 00 00 00 00 00 00 0b 01 00 00

00:12.1 USB controller: Advanced Micro Devices, Inc. [AMD/ATI] SB7x0 USB OHCI1 Controller
00: 02 10 98 43 07 00 a0 02 00 10 03 0c 10 20 00 00
10: 00 90 70 ff 00 00 00 00 00 00 00 00 00 00 00 00
20: 00 00 00 00 00 00 00 00 00 00 00 00 34 17 9a 11
30: 00 00 00 00 00 00 00 00 00 00 00 00 0b 01 00 00

00:12.2 USB controller: Advanced Micro Devices, Inc. [AMD/ATI] SB7x0/SB8x0/SB9x0 USB EHCI Controller
00: 02 10 96 43 17 00 b0 02 00 20 03 0c 10 20 00 00
10: 00 80 70 ff 00 00 00 00 00 00 00 00 00 00 00 00
20: 00 00 00 00 00 00 00 00 00 00 00 00 34 17 9a 11
30: 00 00 00 00 c0 00 00 00 00 00 00 00 0a 02 00 00

00:13.0 USB controller: Advanced Micro Devices, Inc. [AMD/ATI] SB7x0/SB8x0/SB9x0 USB OHCI0 Controller
00: 02 10 97 43 07 00 a0 02 00 10 03 0c 10 20 80 00
10: 00 70 70 ff 00 00 00 00 00 00 00 00 00 00 00 00
20: 00 00 00 00 00 00 00 00 00 00 00 00 34 17 9a 11
30: 00 00 00 00 00 00 00 00 00 00 00 00 0b 01 00 00

00:13.1 USB controller: Advanced Micro Devices, Inc. [AMD/ATI] SB7x0 USB OHCI1 Controller
00: 02 10 98 43 07 00 a0 02 00 10 03 0c 10 20 00 00
10: 00 60 70 ff 00 00 00 00 00 00 00 00 00 00 00 00
20: 00 00 00 00 00 00 00 00 00 00 00 00 34 17 9a 11
30: 00 00 00 00 00 00 00 00 00 00 00 00 0b 01 00 00

00:13.2 USB controller: Advanced Micro Devices, Inc. [AMD/ATI] SB7x0/SB8x0/SB9x0 USB EHCI Controller
00: 02 10 96 43 17 00 b0 02 00 20 03 0c 10 20 00 00
10: 00 50 70 ff 00 00 00 00 00 00 00 00 00 00 00 00
20: 00 00 00 00 00 00 00 00 00 00 00 00 34 17 9a 11
30: 00 00 00 00 c0 00 00 00 00 00 00 00 0a 02 00 00

00:14.0 SMBus: Advanced Micro Devices, Inc. [AMD/ATI] SBx00 SMBus Controller (rev 3c)
00: 02 10 85 43 03 04 30 02 3c 00 05 0c 00 00 80 00
10: 00 00 00 00 00 00 00 00 00 00 00 00 00 00 00 00
20: 00 00 00 00 00 00 00 00 00 00 00 00 34 17 9a 11
30: 00 00 00 00 b0 00 00 00 00 00 00 00 00 00 00 00

00:14.2 Audio device: Advanced Micro Devices, Inc. [AMD/ATI] SBx00 Azalia (Intel HDA)
00: 02 10 83 43 06 00 10 04 00 00 03 04 10 20 00 00
10: 04 00 70 ff 00 00 00 00 00 00 00 00 00 00 00 00
20: 00 00 00 00 00 00 00 00 00 00 00 00 34 17 9c 11
30: 00 00 00 00 50 00 00 00 00 00 00 00 0b 01 00 00

00:14.3 ISA bridge: Advanced Micro Devices, Inc. [AMD/ATI] SB7x0/SB8x0/SB9x0 LPC host controller
00: 02 10 9d 43 0f 00 20 02 00 00 01 06 00 00 80 00
10: 00 00 00 00 00 00 00 00 00 00 00 00 00 00 00 00
20: 00 00 00 00 00 00 00 00 00 00 00 00 34 17 9a 11
30: 00 00 00 00 00 00 00 00 00 00 00 00 00 00 00 00

00:14.4 PCI bridge: Advanced Micro Devices, Inc. [AMD/ATI] SBx00 PCI to PCI Bridge
00: 02 10 84 43 27 00 a0 02 00 01 04 06 00 40 81 00
10: 00 00 00 00 00 00 00 00 00 03 03 40 f0 00 80 22
20: f0 ff 00 00 f0 ff 00 00 00 00 00 00 00 00 00 00
30: 00 00 00 00 00 00 00 00 00 00 00 00 00 00 10 00

00:14.5 USB controller: Advanced Micro Devices, Inc. [AMD/ATI] SB7x0/SB8x0/SB9x0 USB OHCI2 Controller
00: 02 10 99 43 07 00 a0 02 00 10 03 0c 10 20 00 00
10: 00 40 70 ff 00 00 00 00 00 00 00 00 00 00 00 00
20: 00 00 00 00 00 00 00 00 00 00 00 00 34 17 9a 11
30: 00 00 00 00 00 00 00 00 00 00 00 00 0b 03 00 00

00:18.0 Host bridge: Advanced Micro Devices, Inc. [AMD] Family 15h Processor Function 0
00: 22 10 00 16 00 00 10 00 00 00 00 06 00 00 80 00
10: 00 00 00 00 00 00 00 00 00 00 00 00 00 00 00 00
20: 00 00 00 00 00 00 00 00 00 00 00 00 00 00 00 00
30: 00 00 00 00 80 00 00 00 00 00 00 00 00 00 00 00

00:18.1 Host bridge: Advanced Micro Devices, Inc. [AMD] Family 15h Processor Function 1
00: 22 10 01 16 00 00 00 00 00 00 00 06 00 00 80 00
10: 00 00 00 00 00 00 00 00 00 00 00 00 00 00 00 00
20: 00 00 00 00 00 00 00 00 00 00 00 00 00 00 00 00
30: 00 00 00 00 00 00 00 00 00 00 00 00 00 00 00 00

00:18.2 Host bridge: Advanced Micro Devices, Inc. [AMD] Family 15h Processor Function 2
00: 22 10 02 16 00 00 00 00 00 00 00 06 00 00 80 00
10: 00 00 00 00 00 00 00 00 00 00 00 00 00 00 00 00
20: 00 00 00 00 00 00 00 00 00 00 00 00 00 00 00 00
30: 00 00 00 00 00 00 00 00 00 00 00 00 00 00 00 00

00:18.3 Host bridge: Advanced Micro Devices, Inc. [AMD] Family 15h Processor Function 3
00: 22 10 03 16 00 00 10 00 00 00 00 06 00 00 80 00
10: 00 00 00 00 00 00 00 00 00 00 00 00 00 00 00 00
20: 00 00 00 00 00 00 00 00 00 00 00 00 00 00 00 00
30: 00 00 00 00 f0 00 00 00 00 00 00 00 00 00 00 00

00:18.4 Host bridge: Advanced Micro Devices, Inc. [AMD] Family 15h Processor Function 4
00: 22 10 04 16 00 00 00 00 00 00 00 06 00 00 80 00
10: 00 00 00 00 00 00 00 00 00 00 00 00 00 00 00 00
20: 00 00 00 00 00 00 00 00 00 00 00 00 00 00 00 00
30: 00 00 00 00 00 00 00 00 00 00 00 00 00 00 00 00

00:18.5 Host bridge: Advanced Micro Devices, Inc. [AMD] Family 15h Processor Function 5
00: 22 10 05 16 00 00 00 00 00 00 00 06 00 00 80 00
10: 00 00 00 00 00 00 00 00 00 00 00 00 00 00 00 00
20: 00 00 00 00 00 00 00 00 00 00 00 00 00 00 00 00
30: 00 00 00 00 00 00 00 00 00 00 00 00 00 00 00 00

01:05.0 VGA compatible controller: Advanced Micro Devices, Inc. [AMD/ATI] RS880 [Radeon HD 4250]
00: 02 10 15 97 07 00 10 00 00 00 00 03 10 00 80 00
10: 08 00 00 fc 01 e0 00 00 00 00 50 ff 00 00 00 00
20: 00 00 00 00 00 00 40 ff 00 00 00 00 34 17 da 11
30: 00 00 00 00 50 00 00 00 00 00 00 00 0b 01 00 00

01:05.1 Audio device: Advanced Micro Devices, Inc. [AMD/ATI] RS880 HDMI Audio [Radeon HD 4200 Series]
00: 02 10 0f 97 07 00 10 00 00 00 03 04 10 00 80 00
10: 00 00 51 ff 00 00 00 00 00 00 00 00 00 00 00 00
20: 00 00 00 00 00 00 00 00 00 00 00 00 34 17 da 11
30: 00 00 00 00 50 00 00 00 00 00 00 00 0a 02 00 00

02:00.0 Ethernet controller: Broadcom Inc. and subsidiaries NetLink BCM57780 Gigabit Ethernet PCIe (rev 01)
00: e4 14 92 16 06 04 10 00 01 00 00 02 10 00 00 00
10: 04 00 60 ff 00 00 00 00 00 00 00 00 00 00 00 00
20: 00 00 00 00 00 00 00 00 00 00 00 00 34 17 aa 11
30: 00 00 00 00 48 00 00 00 00 00 00 00 0b 01 00 00

