00:00.0 Host bridge: Intel Corporation Coffee Lake HOST and DRAM Controller (rev 0b)
00: 86 80 34 3e 06 00 90 20 0b 00 00 06 00 00 00 00
10: 00 00 00 00 00 00 00 00 00 00 00 00 00 00 00 00
20: 00 00 00 00 00 00 00 00 00 00 00 00 43 10 a1 16
30: 00 00 00 00 e0 00 00 00 00 00 00 00 00 00 00 00
40: 01 90 d1 fe 00 00 00 00 01 00 d1 fe 00 00 00 00
50: c1 02 00 00 b1 80 00 00 47 00 f0 8f 87 00 00 8b
60: 03 00 00 f0 00 00 00 00 01 80 d1 fe 00 00 00 00
70: 00 00 00 fe 03 00 00 00 00 0c 00 fe 7f 00 00 00
80: 01 33 33 33 33 00 00 00 1a 00 00 00 00 00 00 00
90: 01 00 00 fe 03 00 00 00 01 00 f0 6d 04 00 00 00
a0: 01 00 00 00 04 00 00 00 01 00 00 6e 04 00 00 00
b0: 01 00 00 8c 01 00 80 8b 01 00 00 8b 01 00 00 90
c0: 00 00 00 00 00 00 00 00 00 00 00 00 00 00 00 00
d0: 00 00 00 00 00 00 00 00 00 00 00 00 00 00 00 00
e0: 09 00 10 01 b1 60 61 7a 8c 80 11 96 00 c0 04 00
f0: 00 00 00 00 c8 0f 0b 00 00 00 00 00 00 00 00 00

00:02.0 VGA compatible controller: Intel Corporation WhiskeyLake-U GT2 [UHD Graphics 620]
00: 86 80 a0 3e 07 04 10 00 00 00 00 03 10 00 00 00
10: 04 00 00 b2 00 00 00 00 0c 00 00 90 00 00 00 00
20: 01 40 00 00 00 00 00 00 00 00 00 00 43 10 5e 1d
30: 00 00 00 00 40 00 00 00 00 00 00 00 ff 01 00 00
40: 09 70 0c 01 b1 60 61 7a 8c 80 11 96 00 00 00 00
50: c1 02 00 00 b1 80 00 00 00 00 00 00 01 00 00 8c
60: 00 00 01 00 00 00 00 00 00 00 00 00 00 00 00 00
70: 10 ac 92 00 00 80 00 10 00 00 00 00 00 00 00 00
80: 00 00 00 00 00 00 00 00 00 00 00 00 00 00 00 00
90: 00 00 00 00 00 00 00 00 00 00 00 00 00 00 00 00
a0: 00 00 00 00 00 00 00 00 00 00 00 00 05 d0 01 00
b0: 18 00 e0 fe 00 00 00 00 00 00 00 00 00 00 00 00
c0: 00 00 00 00 00 00 00 00 00 00 00 00 00 00 00 00
d0: 01 00 22 00 00 00 00 00 00 00 00 00 00 00 00 00
e0: 00 00 00 00 00 00 00 00 00 80 00 00 00 00 00 00
f0: 00 00 00 00 00 00 00 00 00 00 00 00 18 a0 d0 89

00:04.0 Signal processing controller: Intel Corporation Xeon E3-1200 v5/E3-1500 v5/6th Gen Core Processor Thermal Subsystem (rev 0b)
00: 86 80 03 19 02 00 90 00 0b 00 80 11 00 00 00 00
10: 04 00 41 b4 00 00 00 00 00 00 00 00 00 00 00 00
20: 00 00 00 00 00 00 00 00 00 00 00 00 43 10 a1 16
30: 00 00 00 00 90 00 00 00 00 00 00 00 ff 01 00 00
40: 00 00 00 00 00 00 00 00 00 00 00 00 00 00 00 00
50: 00 00 00 00 b1 80 00 00 00 00 00 00 00 00 00 00
60: 00 00 00 00 00 00 00 00 00 00 00 00 00 00 00 00
70: 00 00 00 00 00 00 00 00 00 00 00 00 00 00 00 00
80: 00 00 00 00 00 00 00 00 00 00 00 00 00 00 00 00
90: 05 d0 00 00 00 00 00 00 00 00 00 00 00 00 00 00
a0: 00 00 00 00 00 00 00 00 00 00 00 00 00 00 00 00
b0: 00 00 00 00 00 00 00 00 00 00 00 00 00 00 00 00
c0: 00 00 00 00 00 00 00 00 00 00 00 00 00 00 00 00
d0: 01 e0 03 00 08 00 00 00 00 00 00 00 00 00 00 00
e0: 09 00 0c 01 b1 60 61 7a 8c 80 11 96 00 00 00 00
f0: 00 00 00 00 00 00 00 00 00 00 00 00 00 00 00 00

00:08.0 System peripheral: Intel Corporation Xeon E3-1200 v5/v6 / E3-1500 v5 / 6th/7th/8th Gen Core Processor Gaussian Mixture Model
00: 86 80 11 19 00 00 10 00 00 00 80 08 10 00 00 00
10: 04 c0 42 b4 00 00 00 00 00 00 00 00 00 00 00 00
20: 00 00 00 00 00 00 00 00 00 00 00 00 43 10 a1 16
30: 00 00 00 00 90 00 00 00 00 00 00 00 ff 01 00 00
40: ff 01 00 00 00 00 00 00 00 00 00 00 00 00 00 00
50: 00 00 00 00 00 00 00 00 00 00 00 00 00 00 00 00
60: 00 00 00 00 00 00 00 00 00 00 00 00 00 00 00 00
70: 00 00 00 00 00 00 00 00 00 00 00 00 00 00 00 00
80: 00 00 00 00 00 00 00 00 00 00 00 00 00 00 00 00
90: 05 dc 00 00 00 00 00 00 00 00 00 00 00 00 00 00
a0: 00 00 00 00 00 00 00 00 00 00 00 00 00 00 00 00
b0: 00 00 00 00 00 00 00 00 00 00 00 00 00 00 00 00
c0: 00 00 00 00 00 00 00 00 00 00 00 00 00 00 00 00
d0: 00 00 00 00 00 00 00 00 00 00 00 00 01 f0 02 00
e0: 00 00 00 00 00 00 00 00 00 00 00 00 00 00 00 00
f0: 13 00 06 03 00 00 00 00 00 00 00 00 00 00 00 00

00:12.0 Signal processing controller: Intel Corporation Cannon Point-LP Thermal Controller (rev 30)
00: 86 80 f9 9d 02 00 10 00 30 00 80 11 00 00 80 00
10: 04 b0 42 b4 00 00 00 00 00 00 00 00 00 00 00 00
20: 00 00 00 00 00 00 00 00 00 00 00 00 43 10 a1 16
30: 00 00 00 00 50 00 00 00 00 00 00 00 ff 01 00 00
40: 04 00 00 00 00 00 00 00 00 00 00 00 00 00 00 00
50: 01 80 23 00 08 00 00 00 00 00 00 00 00 00 00 00
60: 00 00 00 00 00 00 00 00 00 00 00 00 00 00 00 00
70: 00 00 00 00 00 00 00 00 00 00 00 00 00 00 00 00
80: 05 00 00 00 00 00 00 00 00 00 00 00 00 00 00 00
90: 10 00 01 00 c2 0f 00 00 40 00 00 00 11 f0 03 00
a0: 40 00 11 00 00 00 00 00 00 00 00 00 00 00 00 00
b0: 00 00 00 00 00 00 00 00 00 00 00 00 00 00 00 00
c0: 00 00 00 00 00 00 00 00 00 00 00 00 00 00 00 00
d0: 00 00 00 00 00 00 00 00 00 00 00 00 00 00 00 00
e0: 00 00 00 00 00 00 00 00 00 00 00 00 00 00 00 00
f0: 00 00 00 00 00 00 00 00 b5 0f 30 01 00 00 00 00

00:14.0 USB controller: Intel Corporation Cannon Point-LP USB 3.1 xHCI Controller (rev 30)
00: 86 80 ed 9d 06 04 90 02 30 30 03 0c 00 00 80 00
10: 04 00 40 b4 00 00 00 00 00 00 00 00 00 00 00 00
20: 00 00 00 00 00 00 00 00 00 00 00 00 43 10 1f 20
30: 00 00 00 00 70 00 00 00 00 00 00 00 ff 01 00 00
40: fd 01 34 80 8f c6 ff 83 00 00 00 00 00 00 00 00
50: 7f 6d dc 0f 00 00 00 00 46 18 d9 04 00 00 00 00
60: 31 60 00 00 00 00 00 00 00 00 00 00 00 00 00 00
70: 01 80 c2 c1 08 00 00 00 00 00 00 00 00 00 00 00
80: 05 90 87 00 d8 03 e0 fe 00 00 00 00 00 00 00 00
90: 09 00 14 f0 10 00 40 01 00 00 00 00 c1 0a 08 00
a0: 00 08 0e 00 00 18 00 00 8f 40 02 00 00 01 00 00
b0: 00 00 00 00 00 00 00 00 0d 00 00 00 f0 00 00 00
c0: 00 00 00 00 00 00 00 00 00 00 00 00 00 00 00 00
d0: 00 00 00 00 00 00 00 00 0d 00 00 00 00 00 00 00
e0: 00 00 00 00 00 00 00 00 00 00 00 00 00 00 00 00
f0: 00 00 00 00 00 00 00 00 b5 0f 30 01 12 00 00 00

00:14.2 RAM memory: Intel Corporation Cannon Point-LP Shared SRAM (rev 30)
00: 86 80 ef 9d 00 00 10 00 30 00 00 05 10 00 00 00
10: 04 00 42 b4 00 00 00 00 04 a0 42 b4 00 00 00 00
20: 00 00 00 00 00 00 00 00 00 00 00 00 86 80 70 72
30: 00 00 00 00 80 00 00 00 00 00 00 00 ff 00 00 00
40: 00 00 00 00 00 00 00 00 00 00 00 00 00 00 00 00
50: 00 00 00 00 00 00 00 00 00 00 00 00 00 00 00 00
60: 00 00 00 00 00 00 00 00 00 00 00 00 00 00 00 00
70: 00 00 00 00 00 00 00 00 00 00 00 00 00 00 00 00
80: 01 00 03 00 08 00 00 00 00 00 00 00 00 00 00 00
90: 00 00 00 00 00 00 00 00 00 00 00 00 00 00 00 00
a0: 00 00 00 00 00 00 00 00 00 00 00 00 00 00 00 00
b0: 00 00 00 00 00 00 00 00 00 00 00 00 00 00 00 00
c0: 00 00 00 00 00 00 00 00 00 00 00 00 00 00 00 00
d0: 00 00 00 00 00 00 00 00 00 00 00 00 00 00 00 00
e0: 00 00 00 00 00 00 00 00 00 00 00 00 00 00 00 00
f0: 00 00 00 00 00 00 00 00 b5 0f 30 01 00 00 00 00

00:14.3 Network controller: Intel Corporation Cannon Point-LP CNVi [Wireless-AC] (rev 30)
00: 86 80 f0 9d 06 04 10 00 30 00 80 02 10 00 80 00
10: 04 c0 41 b4 00 00 00 00 00 00 00 00 00 00 00 00
20: 00 00 00 00 00 00 00 00 00 00 00 00 86 80 34 00
30: 00 00 00 00 c8 00 00 00 00 00 00 00 ff 01 00 00
40: 10 80 92 00 c0 0e 00 10 10 0c 10 00 00 00 00 00
50: 00 00 00 00 00 00 00 00 00 00 00 00 00 00 00 00
60: 00 00 00 00 12 08 08 00 05 04 00 00 00 00 00 00
70: 00 00 00 00 00 00 00 00 00 00 00 00 00 00 00 00
80: 11 00 0f 80 00 20 00 00 00 30 00 00 00 00 00 00
90: 00 00 00 00 00 00 00 00 00 00 00 00 00 00 00 00
a0: 00 00 00 00 00 00 00 00 00 00 00 00 00 00 00 00
b0: 00 00 00 00 00 00 00 00 00 00 00 00 00 00 00 00
c0: 00 00 00 00 00 00 00 00 01 d0 23 c8 08 00 00 0d
d0: 05 40 80 00 00 00 00 00 00 00 00 00 00 00 00 00
e0: 00 00 00 00 00 00 00 00 00 00 00 00 00 00 00 00
f0: 00 00 00 00 00 00 00 00 00 00 00 00 00 00 00 00

00:15.0 Serial bus controller [0c80]: Intel Corporation Cannon Point-LP Serial IO I2C Controller #0 (rev 30)
00: 86 80 e8 9d 06 00 10 00 30 00 80 0c 10 00 80 00
10: 04 00 00 00 00 00 00 00 00 00 00 00 00 00 00 00
20: 00 00 00 00 00 00 00 00 00 00 00 00 43 10 a1 16
30: 00 00 00 00 80 00 00 00 00 00 00 00 ff 01 00 00
40: 00 00 00 00 00 00 00 00 00 00 00 00 00 00 00 00
50: 00 00 00 00 00 00 00 00 00 00 00 00 00 00 00 00
60: 00 00 00 00 00 00 00 00 00 00 00 00 00 00 00 00
70: 00 00 00 00 00 00 00 00 00 00 00 00 00 00 00 00
80: 01 90 03 00 0b 00 00 00 00 00 00 00 00 00 00 00
90: 09 00 14 f0 10 00 40 01 01 21 00 00 c1 24 00 00
a0: 00 08 0f 00 00 00 00 00 00 00 00 00 00 00 00 00
b0: 00 00 00 00 00 00 00 00 00 00 00 00 00 00 00 00
c0: 00 00 00 00 00 00 00 00 00 00 00 00 00 00 00 00
d0: 00 00 00 00 00 00 00 00 00 00 00 00 00 00 00 00
e0: 00 00 00 00 00 00 00 00 00 00 00 00 00 00 00 00
f0: 00 00 00 00 00 00 00 00 b5 0f 30 01 00 00 00 00

00:15.1 Serial bus controller [0c80]: Intel Corporation Cannon Point-LP Serial IO I2C Controller #1 (rev 30)
00: 86 80 e9 9d 06 00 10 00 30 00 80 0c 10 00 80 00
10: 04 00 00 00 00 00 00 00 00 00 00 00 00 00 00 00
20: 00 00 00 00 00 00 00 00 00 00 00 00 43 10 a1 16
30: 00 00 00 00 80 00 00 00 00 00 00 00 ff 02 00 00
40: 00 00 00 00 00 00 00 00 00 00 00 00 00 00 00 00
50: 00 00 00 00 00 00 00 00 00 00 00 00 00 00 00 00
60: 00 00 00 00 00 00 00 00 00 00 00 00 00 00 00 00
70: 00 00 00 00 00 00 00 00 00 00 00 00 00 00 00 00
80: 01 90 03 00 0b 00 00 00 00 00 00 00 00 00 00 00
90: 09 00 14 f0 10 00 40 01 01 21 00 00 c1 24 00 00
a0: 00 08 0f 00 00 00 00 00 00 00 00 00 00 00 00 00
b0: 00 00 00 00 00 00 00 00 00 00 00 00 00 00 00 00
c0: 00 00 00 00 00 00 00 00 00 00 00 00 00 00 00 00
d0: 00 00 00 00 00 00 00 00 00 00 00 00 00 00 00 00
e0: 00 00 00 00 00 00 00 00 00 00 00 00 00 00 00 00
f0: 00 00 00 00 00 00 00 00 b5 0f 30 01 00 00 00 00

00:16.0 Communication controller: Intel Corporation Cannon Point-LP MEI Controller #1 (rev 30)
00: 86 80 e0 9d 06 04 10 00 30 00 80 07 00 00 80 00
10: 04 70 42 b4 00 00 00 00 00 00 00 00 00 00 00 00
20: 00 00 00 00 00 00 00 00 00 00 00 00 43 10 a1 16
30: 00 00 00 00 50 00 00 00 00 00 00 00 ff 01 00 00
40: 45 02 00 90 00 00 00 80 06 05 11 06 00 00 00 00
50: 01 8c 03 40 08 00 00 00 00 00 00 00 00 00 00 00
60: 20 00 00 00 04 40 00 00 01 1f 00 00 c9 03 40 44
70: 00 00 00 00 00 00 00 00 00 00 00 00 00 00 00 00
80: 00 00 00 00 00 00 00 00 00 00 00 00 05 a4 81 00
90: 98 04 e0 fe 00 00 00 00 00 00 00 00 00 00 00 00
a0: 04 00 00 00 09 00 14 f0 10 00 40 01 00 00 00 00
b0: 01 80 00 00 38 0d 0e 00 00 00 00 00 00 00 00 40
c0: 00 00 00 00 00 00 00 00 00 00 00 00 00 00 00 00
d0: 00 00 00 00 00 00 00 00 00 00 00 00 00 00 00 00
e0: 00 00 00 00 00 00 00 00 00 00 00 00 00 00 00 00
f0: 00 00 00 00 00 00 00 00 b5 0f 30 01 00 00 00 00

00:19.0 Serial bus controller [0c80]: Intel Corporation Cannon Point-LP Serial IO I2C Host Controller (rev 30)
00: 86 80 c5 9d 06 00 10 00 30 00 80 0c 10 00 80 00
10: 04 00 00 00 00 00 00 00 00 00 00 00 00 00 00 00
20: 00 00 00 00 00 00 00 00 00 00 00 00 43 10 a1 16
30: 00 00 00 00 80 00 00 00 00 00 00 00 ff 01 00 00
40: 00 00 00 00 00 00 00 00 00 00 00 00 00 00 00 00
50: 00 00 00 00 00 00 00 00 00 00 00 00 00 00 00 00
60: 00 00 00 00 00 00 00 00 00 00 00 00 00 00 00 00
70: 00 00 00 00 00 00 00 00 00 00 00 00 00 00 00 00
80: 01 90 03 00 0b 00 00 00 00 00 00 00 00 00 00 00
90: 09 00 14 f0 10 00 40 01 01 21 00 00 c1 24 00 00
a0: 00 08 0f 00 00 00 00 00 00 00 00 00 00 00 00 00
b0: 00 00 00 00 00 00 00 00 00 00 00 00 00 00 00 00
c0: 00 00 00 00 00 00 00 00 00 00 00 00 00 00 00 00
d0: 00 00 00 00 00 00 00 00 00 00 00 00 00 00 00 00
e0: 00 00 00 00 00 00 00 00 00 00 00 00 00 00 00 00
f0: 00 00 00 00 00 00 00 00 b5 0f 30 01 00 00 00 00

00:1c.0 PCI bridge: Intel Corporation Cannon Point-LP PCI Express Root Port #1 (rev f0)
00: 86 80 b8 9d 07 04 10 00 f0 00 04 06 10 00 81 00
10: 00 00 00 00 00 00 00 00 00 01 01 00 f0 00 00 20
20: f0 ff 00 00 f1 ff 01 00 00 00 00 00 00 00 00 00
30: 00 00 00 00 40 00 00 00 00 00 00 00 ff 00 12 00
40: 10 80 42 00 01 80 00 00 00 00 10 00 13 4c 71 01
50: 03 00 01 10 60 00 04 00 00 00 40 00 08 00 00 00
60: 00 00 00 00 37 08 08 00 00 00 00 00 0e 00 00 00
70: 03 00 01 00 00 00 00 00 00 00 00 00 00 00 00 00
80: 05 90 01 00 f8 01 e0 fe 00 00 00 00 00 00 00 00
90: 0d a0 00 00 43 10 a1 16 00 00 00 00 00 00 00 00
a0: 01 00 03 c8 03 01 00 00 00 00 00 00 00 00 00 00
b0: 00 00 00 00 00 00 00 00 00 00 00 00 00 00 00 00
c0: 00 00 00 00 00 00 00 00 00 00 00 00 00 00 00 00
d0: 11 00 00 07 00 08 02 00 02 00 11 09 00 00 00 00
e0: 00 77 11 00 00 00 00 00 04 80 02 00 00 00 00 00
f0: 50 01 00 00 00 f3 00 40 b5 0f 30 01 04 00 00 40

00:1c.4 PCI bridge: Intel Corporation Cannon Point-LP PCI Express Root Port #5 (rev f0)
00: 86 80 bc 9d 07 04 10 00 f0 00 04 06 10 00 81 00
10: 00 00 00 00 00 00 00 00 00 02 02 00 30 30 00 20
20: 00 b3 00 b4 01 a0 f1 b1 00 00 00 00 00 00 00 00
30: 00 00 00 00 40 00 00 00 00 00 00 00 ff 01 12 00
40: 10 80 42 01 01 80 00 00 2f 00 10 00 43 40 72 05
50: 40 00 41 f0 00 fd 44 00 00 00 40 01 08 00 00 00
60: 00 00 00 00 37 08 00 00 00 04 00 00 0e 00 00 00
70: 03 00 1f 00 00 00 00 00 00 00 00 00 00 00 00 00
80: 05 90 01 00 38 02 e0 fe 00 00 00 00 00 00 00 00
90: 0d a0 00 00 43 10 a1 16 00 00 00 00 00 00 00 00
a0: 01 00 03 c8 00 00 00 00 00 00 00 00 00 00 00 00
b0: 00 00 00 00 00 00 00 00 00 00 00 00 00 00 00 00
c0: 00 00 00 00 00 00 00 00 00 00 00 00 00 00 00 00
d0: 11 10 00 07 42 18 02 00 08 00 9e 09 00 00 00 00
e0: 00 77 f3 00 64 88 64 88 16 80 12 00 00 00 00 00
f0: 50 01 00 00 00 03 00 50 b5 0f 30 01 04 c0 00 41

00:1d.0 PCI bridge: Intel Corporation Cannon Point-LP PCI Express Root Port #9 (rev f0)
00: 86 80 b0 9d 07 04 10 00 f0 00 04 06 10 00 81 00
10: 00 00 00 00 00 00 00 00 00 03 03 00 f0 00 00 20
20: 30 b4 30 b4 f1 ff 01 00 00 00 00 00 00 00 00 00
30: 00 00 00 00 40 00 00 00 00 00 00 00 ff 01 12 00
40: 10 80 42 01 01 80 00 00 0f 00 10 00 13 4c 72 09
50: 43 00 11 70 00 b2 64 00 00 00 40 01 08 00 00 00
60: 00 00 00 00 37 08 00 00 00 04 00 00 0e 00 00 00
70: 03 00 01 00 00 00 00 00 00 00 00 00 00 00 00 00
80: 05 90 01 00 58 02 e0 fe 00 00 00 00 00 00 00 00
90: 0d a0 00 00 43 10 a1 16 00 00 00 00 00 00 00 00
a0: 01 00 03 c8 00 00 00 00 00 00 00 00 00 00 00 00
b0: 00 00 00 00 00 00 00 00 00 00 00 00 00 00 00 00
c0: 00 00 00 00 00 00 00 00 00 00 00 00 00 00 00 00
d0: 01 10 00 07 42 18 02 00 08 00 9e 09 00 00 00 00
e0: 00 77 73 00 03 90 00 00 16 80 12 00 00 00 00 00
f0: 50 01 00 00 00 03 00 50 b5 0f 30 01 04 00 00 41

00:1d.4 PCI bridge: Intel Corporation Cannon Point-LP PCI Express Root Port #13 (rev f0)
00: 86 80 b4 9d 07 04 10 00 f0 00 04 06 10 00 81 00
10: 00 00 00 00 00 00 00 00 00 04 04 00 f0 00 00 20
20: 20 b4 20 b4 f1 ff 01 00 00 00 00 00 00 00 00 00
30: 00 00 00 00 40 00 00 00 00 00 00 00 ff 01 12 00
40: 10 80 42 01 01 80 00 00 2f 00 10 00 43 4c 72 0d
50: 42 00 43 70 00 fd 84 00 00 00 40 01 08 00 00 00
60: 00 00 00 00 37 08 00 00 00 04 00 00 0e 00 00 00
70: 03 00 1f 00 00 00 00 00 00 00 00 00 00 00 00 00
80: 05 90 01 00 78 02 e0 fe 00 00 00 00 00 00 00 00
90: 0d a0 00 00 43 10 a1 16 00 00 00 00 00 00 00 00
a0: 01 00 03 c8 00 00 00 00 00 00 00 00 00 00 00 00
b0: 00 00 00 00 00 00 00 00 00 00 00 00 00 00 00 00
c0: 00 00 00 00 00 00 00 00 00 00 00 00 00 00 00 00
d0: 11 10 00 07 42 18 02 00 08 00 9e 09 00 00 00 00
e0: 00 77 f3 00 f4 89 f4 89 16 80 12 00 00 00 00 00
f0: 50 01 00 00 00 03 00 50 b5 0f 30 01 04 c0 00 41

00:1e.0 Communication controller: Intel Corporation Cannon Point-LP Serial IO UART Controller #2 (rev 30)
00: 86 80 a8 9d 06 00 10 00 30 00 80 07 10 00 80 00
10: 04 50 42 b4 00 00 00 00 04 40 42 b4 00 00 00 00
20: 00 00 00 00 00 00 00 00 00 00 00 00 43 10 a1 16
30: 00 00 00 00 80 00 00 00 00 00 00 00 ff 01 00 00
40: 00 00 00 00 00 00 00 00 00 00 00 00 00 00 00 00
50: 00 00 00 00 00 00 00 00 00 00 00 00 00 00 00 00
60: 00 00 00 00 00 00 00 00 00 00 00 00 00 00 00 00
70: 00 00 00 00 00 00 00 00 00 00 00 00 00 00 00 00
80: 01 90 03 00 0b 00 00 00 00 00 00 00 00 00 00 00
90: 09 00 14 f0 10 00 40 01 01 21 00 00 c1 24 00 00
a0: 00 08 0f 00 00 00 00 00 00 00 00 00 00 00 00 00
b0: 00 00 00 00 00 00 00 00 00 00 00 00 00 00 00 00
c0: 00 00 00 00 00 00 00 00 00 00 00 00 00 00 00 00
d0: 00 00 00 00 00 00 00 00 00 00 00 00 00 00 00 00
e0: 00 00 00 00 00 00 00 00 00 00 00 00 00 00 00 00
f0: 00 00 00 00 00 00 00 00 b5 0f 30 01 00 00 00 00

00:1e.2 Serial bus controller [0c80]: Intel Corporation Cannon Point-LP Serial IO SPI Controller (rev 30)
00: 86 80 aa 9d 06 00 10 00 30 00 80 0c 10 00 80 00
10: 04 00 00 00 00 00 00 00 00 00 00 00 00 00 00 00
20: 00 00 00 00 00 00 00 00 00 00 00 00 43 10 a1 16
30: 00 00 00 00 80 00 00 00 00 00 00 00 ff 03 00 00
40: 00 00 00 00 00 00 00 00 00 00 00 00 00 00 00 00
50: 00 00 00 00 00 00 00 00 00 00 00 00 00 00 00 00
60: 00 00 00 00 00 00 00 00 00 00 00 00 00 00 00 00
70: 00 00 00 00 00 00 00 00 00 00 00 00 00 00 00 00
80: 01 90 03 00 0b 00 00 00 00 00 00 00 00 00 00 00
90: 09 00 14 f0 10 00 40 01 01 21 00 00 c1 24 00 00
a0: 00 08 0f 00 00 00 00 00 00 00 00 00 00 00 00 00
b0: 00 00 00 00 00 00 00 00 00 00 00 00 00 00 00 00
c0: 00 00 00 00 00 00 00 00 00 00 00 00 00 00 00 00
d0: 00 00 00 00 00 00 00 00 00 00 00 00 00 00 00 00
e0: 00 00 00 00 00 00 00 00 00 00 00 00 00 00 00 00
f0: 00 00 00 00 00 00 00 00 b5 0f 30 01 00 00 00 00

00:1f.0 ISA bridge: Intel Corporation Cannon Point-LP LPC Controller (rev 30)
00: 86 80 84 9d 07 00 00 02 30 00 01 06 00 00 80 00
10: 00 00 00 00 00 00 00 00 00 00 00 00 00 00 00 00
20: 00 00 00 00 00 00 00 00 00 00 00 00 43 10 a1 16
30: 00 00 00 00 00 00 00 00 00 00 00 00 00 00 00 00
40: 00 00 00 00 00 00 00 00 00 00 00 00 00 00 00 00
50: 00 00 00 00 00 00 00 00 00 00 00 00 00 00 00 00
60: 00 00 00 00 90 00 00 00 00 00 00 00 00 00 00 00
70: 00 00 00 00 00 00 00 00 00 00 00 00 00 00 00 00
80: 10 00 03 3c 81 06 0c 00 41 16 0c 00 51 02 0c 00
90: 81 03 0c 00 00 0f 00 00 00 00 00 00 00 00 00 00
a0: 00 00 00 00 00 00 00 00 00 00 00 00 00 00 00 00
b0: 00 00 00 00 00 00 00 00 00 00 00 00 00 00 00 00
c0: 00 00 00 00 00 00 00 00 00 00 00 00 00 00 00 00
d0: 33 22 11 00 67 45 00 00 cf ff 00 00 a2 00 00 00
e0: 09 03 00 00 00 00 00 00 00 00 00 00 00 00 00 00
f0: 00 00 00 00 00 00 00 00 b5 0f 30 01 00 00 00 00

00:1f.3 Audio device: Intel Corporation Cannon Point-LP High Definition Audio Controller (rev 30)
00: 86 80 c8 9d 06 04 10 00 30 80 03 04 10 20 00 00
10: 04 80 41 b4 00 00 00 00 00 00 00 00 00 00 00 00
20: 04 00 10 b4 00 00 00 00 00 00 00 00 43 10 a1 16
30: 00 00 00 00 50 00 00 00 00 00 00 00 ff 01 00 00
40: 00 00 00 00 00 00 00 00 ff 09 7b 00 00 00 00 00
50: 01 80 43 c0 08 00 00 00 00 00 00 00 00 00 00 00
60: 05 00 81 00 78 05 e0 fe 00 00 00 00 00 00 00 00
70: 10 00 91 00 00 00 00 10 00 20 10 00 00 00 00 00
80: 09 60 14 f0 10 00 40 01 00 00 00 00 a1 04 01 00
90: 00 08 28 00 00 00 00 00 00 00 00 00 00 00 00 00
a0: 00 00 00 00 00 00 00 00 00 00 00 00 00 00 00 00
b0: 00 00 00 00 00 00 00 00 00 00 00 00 00 00 00 00
c0: 08 06 02 21 00 60 80 04 00 0c a5 82 10 00 03 00
d0: 00 0c b5 02 10 00 03 00 00 00 00 00 00 00 00 00
e0: 00 00 00 00 00 00 00 00 00 00 00 00 00 00 00 00
f0: 00 00 00 00 00 00 00 00 b5 0f 30 01 00 00 00 00

00:1f.4 SMBus: Intel Corporation Cannon Point-LP SMBus Controller (rev 30)
00: 86 80 a3 9d 03 00 80 02 30 00 05 0c 00 00 00 00
10: 04 20 42 b4 00 00 00 00 00 00 00 00 00 00 00 00
20: a1 ef 00 00 00 00 00 00 00 00 00 00 43 10 a1 16
30: 00 00 00 00 00 00 00 00 00 00 00 00 ff 01 00 00
40: 11 00 00 00 00 00 00 00 00 00 00 00 00 00 00 00
50: 01 04 00 00 01 01 00 00 00 00 00 00 00 00 00 00
60: 04 05 05 00 00 00 0a 0a 00 00 00 00 00 00 00 00
70: 00 00 00 00 00 00 00 00 00 00 00 00 00 00 00 00
80: 24 00 00 00 00 00 00 00 00 00 00 00 00 00 00 00
90: 00 00 21 01 00 0c 00 00 17 00 20 01 00 0c 00 00
a0: 00 00 00 00 00 00 00 00 00 00 00 00 00 00 00 00
b0: 00 00 00 00 00 00 00 00 00 00 00 00 00 00 00 00
c0: 00 00 00 00 00 00 00 00 00 00 00 00 00 00 00 00
d0: 00 00 00 00 00 00 00 00 00 00 00 00 00 00 00 00
e0: 00 00 00 00 00 00 00 00 00 00 00 00 00 00 00 00
f0: 00 00 00 00 00 00 00 00 b5 0f 30 01 00 00 00 00

00:1f.5 Serial bus controller [0c80]: Intel Corporation Cannon Point-LP SPI Controller (rev 30)
00: 86 80 a4 9d 02 04 00 00 30 00 80 0c 00 00 00 00
10: 00 00 01 fe 00 00 00 00 00 00 00 00 00 00 00 00
20: 00 00 00 00 00 00 00 00 00 00 00 00 86 80 70 72
30: 00 00 00 00 00 00 00 00 00 00 00 00 00 00 00 00
40: 00 00 00 00 00 00 00 00 00 00 00 00 00 00 00 00
50: 00 00 00 00 00 00 00 00 00 00 00 00 00 00 00 00
60: 00 00 00 00 00 00 00 00 00 00 00 00 00 00 00 00
70: 00 00 00 00 00 00 00 00 00 00 00 00 00 00 00 00
80: 00 00 00 00 00 00 00 00 00 00 00 00 00 00 00 00
90: 00 00 00 00 00 00 00 00 00 00 00 00 00 00 00 00
a0: 00 00 00 00 00 00 00 00 00 00 00 00 00 00 00 00
b0: 00 00 00 00 00 00 00 00 00 00 00 00 00 00 00 00
c0: 00 00 00 00 00 00 00 00 00 00 00 00 00 00 00 00
d0: 00 00 00 00 00 00 00 00 cf ff 00 00 aa 08 00 00
e0: 00 00 00 00 00 00 00 00 00 00 00 00 00 00 00 00
f0: 00 00 00 00 00 00 00 00 b5 0f 30 01 00 00 00 00

02:00.0 3D controller: NVIDIA Corporation GP108M [GeForce MX150] (rev a1)
00: de 10 12 1d 07 04 10 00 a1 00 02 03 00 00 00 00
10: 00 00 00 b3 0c 00 00 a0 00 00 00 00 0c 00 00 b0
20: 00 00 00 00 01 30 00 00 00 00 00 00 43 10 5e 1d
30: 00 00 00 00 60 00 00 00 00 00 00 00 ff 01 00 00
40: 43 10 5e 1d 00 00 00 00 00 00 00 00 00 00 00 00
50: 00 00 00 00 01 00 00 00 ce d6 23 00 00 00 00 00
60: 01 68 03 00 08 00 00 00 05 78 81 00 98 05 e0 fe
70: 00 00 00 00 00 00 00 00 10 00 02 00 e1 8d e8 07
80: 30 29 00 00 43 3c 46 00 40 01 41 10 00 00 00 00
90: 00 00 00 00 00 00 00 00 00 00 00 00 13 08 04 00
a0: 00 04 00 00 0e 00 00 00 03 00 1e 00 00 00 00 00
b0: 00 00 00 00 09 00 14 01 00 00 10 80 00 00 00 00
c0: 00 00 00 00 00 00 00 00 00 00 00 00 00 00 00 00
d0: 00 00 00 00 00 00 00 00 00 00 00 00 00 00 00 00
e0: 00 00 00 00 00 00 00 00 00 00 00 00 00 00 00 00
f0: 00 00 00 00 00 00 00 00 00 00 00 00 00 00 00 00

03:00.0 Unassigned class [ff00]: Realtek Semiconductor Co., Ltd. RTS522A PCI Express Card Reader (rev 01)
00: ec 10 2a 52 06 04 10 00 01 00 00 ff 10 00 00 00
10: 00 00 30 b4 00 00 00 00 00 00 00 00 00 00 00 00
20: 00 00 00 00 00 00 00 00 00 00 00 00 43 10 2f 20
30: 00 00 00 00 40 00 00 00 00 00 00 00 ff 01 00 00
40: 01 50 c3 f7 00 00 00 00 00 00 00 00 00 00 00 00
50: 05 70 81 00 b8 03 e0 fe 00 00 00 00 00 00 00 00
60: 00 00 00 00 00 00 00 00 00 00 00 00 00 00 00 00
70: 10 00 02 00 c0 8f 90 05 10 20 10 00 11 7c 47 00
80: 43 01 11 10 00 00 00 00 00 00 00 00 00 00 00 00
90: 00 00 00 00 10 08 0c 00 00 04 00 00 00 00 00 00
a0: 01 00 01 00 00 00 00 00 00 00 00 00 00 00 00 00
b0: 00 00 00 00 00 00 00 00 00 00 00 00 00 00 00 00
c0: 00 00 00 00 00 00 00 00 00 00 00 00 00 00 00 00
d0: 00 00 00 00 00 00 00 00 00 00 00 00 00 00 00 00
e0: 00 00 00 00 00 00 00 00 0f ff 3b 3e 00 00 00 00
f0: 00 00 00 00 00 00 00 00 00 00 00 00 00 00 00 00

04:00.0 Non-Volatile memory controller: Toshiba Corporation Device 0116
00: 79 11 16 01 06 04 10 00 00 02 08 01 10 00 00 00
10: 04 00 20 b4 00 00 00 00 00 00 00 00 00 00 00 00
20: 00 00 00 00 00 00 00 00 00 00 00 00 79 11 01 00
30: 00 00 00 00 40 00 00 00 00 00 00 00 ff 01 00 00
40: 10 80 02 00 c1 8f e8 17 2f 20 00 00 43 d8 42 00
50: 42 00 43 10 00 00 00 00 00 00 00 00 00 00 00 00
60: 00 00 00 00 13 08 10 00 00 04 00 00 0e 00 00 00
70: 03 00 1e 00 00 00 00 00 00 00 00 00 00 00 00 00
80: 01 90 03 00 08 00 00 00 00 00 00 00 00 00 00 00
90: 05 b0 8a 01 00 00 00 00 00 00 00 00 00 00 00 00
a0: 00 00 00 00 00 00 00 00 00 00 00 00 00 00 00 00
b0: 11 00 1f 80 00 20 00 00 00 30 00 00 00 00 00 00
c0: 00 00 00 00 00 00 00 00 00 00 00 00 00 00 00 00
d0: 00 00 00 00 00 00 00 00 00 00 00 00 00 00 00 00
e0: 00 00 00 00 00 00 00 00 00 00 00 00 00 00 00 00
f0: 00 00 00 00 00 00 00 00 00 00 00 00 00 00 00 00

