
0000:00:00.0 Host bridge: Intel 
	Subsystem: ASUSTeK Computer Inc. Device 16a1
	Flags: bus master, fast devsel, latency 0
	Capabilities: <access denied>
	Kernel driver in use: skl_uncore
00: 86 80 34 3e 06 00 90 20 0b 00 00 06 00 00 00 00
10: 00 00 00 00 00 00 00 00 00 00 00 00 00 00 00 00
20: 00 00 00 00 00 00 00 00 00 00 00 00 43 10 a1 16
30: 00 00 00 00 e0 00 00 00 00 00 00 00 00 00 00 00

2222:00:02.0 VGA compatible controller: Intel Corporation WhiskeyLake-U GT2 [UHD Graphics 620] (prog-if 00 [VGA controller])
	DeviceName: VGA
	Subsystem: ASUSTeK Computer Inc. Device 1d5e
	Flags: bus master, fast devsel, latency 0, IRQ 144
	Memory at b2000000 (64-bit, non-prefetchable) [size=16M]
	Memory at 90000000 (64-bit, prefetchable) [size=256M]
	I/O ports at 4000 [size=64]
	Expansion ROM at 000c0000 [virtual] [disabled] [size=128K]
	Capabilities: <access denied>
	Kernel driver in use: i915
	Kernel modules: i915
00: 86 80 a0 3e 07 04 10 00 00 00 00 03 10 00 00 00
10: 04 00 00 b2 00 00 00 00 0c 00 00 90 00 00 00 00
20: 01 40 00 00 00 00 00 00 00 00 00 00 43 10 5e 1d
30: 00 00 00 00 40 00 00 00 00 00 00 00 ff 01 00 00

00:04.0 Signal processing controller: Intel Corporation Xeon E3-1200 v5/E3-1500 v5/6th Gen Core Processor Thermal Subsystem (rev 0b)
	Subsystem: ASUSTeK Computer Inc. Device 16a1
	Flags: fast devsel, IRQ 16
	Memory at b4410000 (64-bit, non-prefetchable) [size=32K]
	Capabilities: <access denied>
	Kernel driver in use: proc_thermal
	Kernel modules: processor_thermal_device
00: 86 80 03 19 02 00 90 00 0b 00 80 11 00 00 00 00
10: 04 00 41 b4 00 00 00 00 00 00 00 00 00 00 00 00
20: 00 00 00 00 00 00 00 00 00 00 00 00 43 10 a1 16
30: 00 00 00 00 90 00 00 00 00 00 00 00 ff 01 00 00

00:08.0 System peripheral: Intel Corporation Xeon E3-1200 v5/v6 / E3-1500 v5 / 6th/7th/8th Gen Core Processor Gaussian Mixture Model
	Subsystem: ASUSTeK Computer Inc. Device 16a1
	Flags: fast devsel, IRQ 255
	Memory at b442c000 (64-bit, non-prefetchable) [disabled] [size=4K]
	Capabilities: <access denied>
00: 86 80 11 19 00 00 10 00 00 00 80 08 10 00 00 00
10: 04 c0 42 b4 00 00 00 00 00 00 00 00 00 00 00 00
20: 00 00 00 00 00 00 00 00 00 00 00 00 43 10 a1 16
30: 00 00 00 00 90 00 00 00 00 00 00 00 ff 01 00 00

00:12.0 Signal processing controller: Intel Corporation Cannon Point-LP Thermal Controller (rev 30)
	Subsystem: ASUSTeK Computer Inc. Device 16a1
	Flags: fast devsel, IRQ 16
	Memory at b442b000 (64-bit, non-prefetchable) [size=4K]
	Capabilities: <access denied>
	Kernel driver in use: intel_pch_thermal
	Kernel modules: intel_pch_thermal
00: 86 80 f9 9d 02 00 10 00 30 00 80 11 00 00 80 00
10: 04 b0 42 b4 00 00 00 00 00 00 00 00 00 00 00 00
20: 00 00 00 00 00 00 00 00 00 00 00 00 43 10 a1 16
30: 00 00 00 00 50 00 00 00 00 00 00 00 ff 01 00 00

00:14.0 USB controller: Intel Corporation Cannon Point-LP USB 3.1 xHCI Controller (rev 30) (prog-if 30 [XHCI])
	Subsystem: ASUSTeK Computer Inc. Device 201f
	Flags: bus master, medium devsel, latency 0, IRQ 135
	Memory at b4400000 (64-bit, non-prefetchable) [size=64K]
	Capabilities: <access denied>
	Kernel driver in use: xhci_hcd
	Kernel modules: xhci_pci
00: 86 80 ed 9d 06 04 90 02 30 30 03 0c 00 00 80 00
10: 04 00 40 b4 00 00 00 00 00 00 00 00 00 00 00 00
20: 00 00 00 00 00 00 00 00 00 00 00 00 43 10 1f 20
30: 00 00 00 00 70 00 00 00 00 00 00 00 ff 01 00 00

00:14.2 RAM memory: Intel Corporation Cannon Point-LP Shared SRAM (rev 30)
	Subsystem: Intel Corporation Device 7270
	Flags: fast devsel
	Memory at b4420000 (64-bit, non-prefetchable) [disabled] [size=8K]
	Memory at b442a000 (64-bit, non-prefetchable) [disabled] [size=4K]
	Capabilities: <access denied>
00: 86 80 ef 9d 00 00 10 00 30 00 00 05 10 00 00 00
10: 04 00 42 b4 00 00 00 00 04 a0 42 b4 00 00 00 00
20: 00 00 00 00 00 00 00 00 00 00 00 00 86 80 70 72
30: 00 00 00 00 80 00 00 00 00 00 00 00 ff 00 00 00

00:14.3 Network controller: Intel Corporation Cannon Point-LP CNVi [Wireless-AC] (rev 30)
	DeviceName: WLAN
	Subsystem: Intel Corporation Device 0034
	Flags: bus master, fast devsel, latency 0, IRQ 16
	Memory at b441c000 (64-bit, non-prefetchable) [size=16K]
	Capabilities: <access denied>
	Kernel driver in use: iwlwifi
	Kernel modules: iwlwifi
00: 86 80 f0 9d 06 04 10 00 30 00 80 02 10 00 80 00
10: 04 c0 41 b4 00 00 00 00 00 00 00 00 00 00 00 00
20: 00 00 00 00 00 00 00 00 00 00 00 00 86 80 34 00
30: 00 00 00 00 c8 00 00 00 00 00 00 00 ff 01 00 00

00:15.0 Serial bus controller [0c80]: Intel Corporation Cannon Point-LP Serial IO I2C Controller #0 (rev 30)
	Subsystem: ASUSTeK Computer Inc. Device 16a1
	Flags: bus master, fast devsel, latency 0, IRQ 16
	Memory at b4423000 (64-bit, non-prefetchable) [virtual] [size=4K]
	Capabilities: <access denied>
	Kernel driver in use: intel-lpss
	Kernel modules: intel_lpss_pci
00: 86 80 e8 9d 06 00 10 00 30 00 80 0c 10 00 80 00
10: 04 00 00 00 00 00 00 00 00 00 00 00 00 00 00 00
20: 00 00 00 00 00 00 00 00 00 00 00 00 43 10 a1 16
30: 00 00 00 00 80 00 00 00 00 00 00 00 ff 01 00 00

00:15.1 Serial bus controller [0c80]: Intel Corporation Cannon Point-LP Serial IO I2C Controller #1 (rev 30)
	Subsystem: ASUSTeK Computer Inc. Device 16a1
	Flags: bus master, fast devsel, latency 0, IRQ 17
	Memory at b4426000 (64-bit, non-prefetchable) [virtual] [size=4K]
	Capabilities: <access denied>
	Kernel driver in use: intel-lpss
	Kernel modules: intel_lpss_pci
00: 86 80 e9 9d 06 00 10 00 30 00 80 0c 10 00 80 00
10: 04 00 00 00 00 00 00 00 00 00 00 00 00 00 00 00
20: 00 00 00 00 00 00 00 00 00 00 00 00 43 10 a1 16
30: 00 00 00 00 80 00 00 00 00 00 00 00 ff 02 00 00

00:16.0 Communication controller: Intel Corporation Cannon Point-LP MEI Controller #1 (rev 30)
	Subsystem: ASUSTeK Computer Inc. Device 16a1
	Flags: bus master, fast devsel, latency 0, IRQ 137
	Memory at b4427000 (64-bit, non-prefetchable) [size=4K]
	Capabilities: <access denied>
	Kernel driver in use: mei_me
	Kernel modules: mei_me
00: 86 80 e0 9d 06 04 10 00 30 00 80 07 00 00 80 00
10: 04 70 42 b4 00 00 00 00 00 00 00 00 00 00 00 00
20: 00 00 00 00 00 00 00 00 00 00 00 00 43 10 a1 16
30: 00 00 00 00 50 00 00 00 00 00 00 00 ff 01 00 00

00:19.0 Serial bus controller [0c80]: Intel Corporation Cannon Point-LP Serial IO I2C Host Controller (rev 30)
	Subsystem: ASUSTeK Computer Inc. Device 16a1
	Flags: bus master, fast devsel, latency 0, IRQ 32
	Memory at b4428000 (64-bit, non-prefetchable) [virtual] [size=4K]
	Capabilities: <access denied>
	Kernel driver in use: intel-lpss
	Kernel modules: intel_lpss_pci
00: 86 80 c5 9d 06 00 10 00 30 00 80 0c 10 00 80 00
10: 04 00 00 00 00 00 00 00 00 00 00 00 00 00 00 00
20: 00 00 00 00 00 00 00 00 00 00 00 00 43 10 a1 16
30: 00 00 00 00 80 00 00 00 00 00 00 00 ff 01 00 00

00:1c.0 PCI bridge: Intel Corporation Cannon Point-LP PCI Express Root Port #1 (rev f0) (prog-if 00 [Normal decode])
	Flags: bus master, fast devsel, latency 0, IRQ 122
	Bus: primary=00, secondary=01, subordinate=01, sec-latency=0
	I/O behind bridge: [disabled]
	Memory behind bridge: [disabled]
	Prefetchable memory behind bridge: [disabled]
	Capabilities: <access denied>
	Kernel driver in use: pcieport
00: 86 80 b8 9d 07 04 10 00 f0 00 04 06 10 00 81 00
10: 00 00 00 00 00 00 00 00 00 01 01 00 f0 00 00 20
20: f0 ff 00 00 f1 ff 01 00 00 00 00 00 00 00 00 00
30: 00 00 00 00 40 00 00 00 00 00 00 00 ff 00 12 00

00:1c.4 PCI bridge: Intel Corporation Cannon Point-LP PCI Express Root Port #5 (rev f0) (prog-if 00 [Normal decode])
	Flags: bus master, fast devsel, latency 0, IRQ 123
	Bus: primary=00, secondary=02, subordinate=02, sec-latency=0
	I/O behind bridge: 00003000-00003fff [size=4K]
	Memory behind bridge: b3000000-b40fffff [size=17M]
	Prefetchable memory behind bridge: 00000000a0000000-00000000b1ffffff [size=288M]
	Capabilities: <access denied>
	Kernel driver in use: pcieport
00: 86 80 bc 9d 07 04 10 00 f0 00 04 06 10 00 81 00
10: 00 00 00 00 00 00 00 00 00 02 02 00 30 30 00 20
20: 00 b3 00 b4 01 a0 f1 b1 00 00 00 00 00 00 00 00
30: 00 00 00 00 40 00 00 00 00 00 00 00 ff 01 12 00

00:1d.0 PCI bridge: Intel Corporation Cannon Point-LP PCI Express Root Port #9 (rev f0) (prog-if 00 [Normal decode])
	Flags: bus master, fast devsel, latency 0, IRQ 124
	Bus: primary=00, secondary=03, subordinate=03, sec-latency=0
	I/O behind bridge: [disabled]
	Memory behind bridge: b4300000-b43fffff [size=1M]
	Prefetchable memory behind bridge: [disabled]
	Capabilities: <access denied>
	Kernel driver in use: pcieport
00: 86 80 b0 9d 07 04 10 00 f0 00 04 06 10 00 81 00
10: 00 00 00 00 00 00 00 00 00 03 03 00 f0 00 00 20
20: 30 b4 30 b4 f1 ff 01 00 00 00 00 00 00 00 00 00
30: 00 00 00 00 40 00 00 00 00 00 00 00 ff 01 12 00

00:1d.4 PCI bridge: Intel Corporation Cannon Point-LP PCI Express Root Port #13 (rev f0) (prog-if 00 [Normal decode])
	Flags: bus master, fast devsel, latency 0, IRQ 125
	Bus: primary=00, secondary=04, subordinate=04, sec-latency=0
	I/O behind bridge: [disabled]
	Memory behind bridge: b4200000-b42fffff [size=1M]
	Prefetchable memory behind bridge: [disabled]
	Capabilities: <access denied>
	Kernel driver in use: pcieport
00: 86 80 b4 9d 07 04 10 00 f0 00 04 06 10 00 81 00
10: 00 00 00 00 00 00 00 00 00 04 04 00 f0 00 00 20
20: 20 b4 20 b4 f1 ff 01 00 00 00 00 00 00 00 00 00
30: 00 00 00 00 40 00 00 00 00 00 00 00 ff 01 12 00

00:1e.0 Communication controller: Intel Corporation Cannon Point-LP Serial IO UART Controller #2 (rev 30)
	Subsystem: ASUSTeK Computer Inc. Device 16a1
	Flags: bus master, fast devsel, latency 0, IRQ 20
	Memory at b4425000 (64-bit, non-prefetchable) [size=4K]
	Memory at b4424000 (64-bit, non-prefetchable) [size=4K]
	Capabilities: <access denied>
	Kernel driver in use: intel-lpss
	Kernel modules: intel_lpss_pci
00: 86 80 a8 9d 06 00 10 00 30 00 80 07 10 00 80 00
10: 04 50 42 b4 00 00 00 00 04 40 42 b4 00 00 00 00
20: 00 00 00 00 00 00 00 00 00 00 00 00 43 10 a1 16
30: 00 00 00 00 80 00 00 00 00 00 00 00 ff 01 00 00

00:1e.2 Serial bus controller [0c80]: Intel Corporation Cannon Point-LP Serial IO SPI Controller (rev 30)
	Subsystem: ASUSTeK Computer Inc. Device 16a1
	Flags: bus master, fast devsel, latency 0, IRQ 22
	Memory at b4429000 (64-bit, non-prefetchable) [virtual] [size=4K]
	Capabilities: <access denied>
	Kernel driver in use: intel-lpss
	Kernel modules: intel_lpss_pci
00: 86 80 aa 9d 06 00 10 00 30 00 80 0c 10 00 80 00
10: 04 00 00 00 00 00 00 00 00 00 00 00 00 00 00 00
20: 00 00 00 00 00 00 00 00 00 00 00 00 43 10 a1 16
30: 00 00 00 00 80 00 00 00 00 00 00 00 ff 03 00 00

00:1f.0 ISA bridge: Intel Corporation Cannon Point-LP LPC Controller (rev 30)
	Subsystem: ASUSTeK Computer Inc. Device 16a1
	Flags: bus master, medium devsel, latency 0
00: 86 80 84 9d 07 00 00 02 30 00 01 06 00 00 80 00
10: 00 00 00 00 00 00 00 00 00 00 00 00 00 00 00 00
20: 00 00 00 00 00 00 00 00 00 00 00 00 43 10 a1 16
30: 00 00 00 00 00 00 00 00 00 00 00 00 00 00 00 00

00:1f.3 Audio device: Intel Corporation Cannon Point-LP High Definition Audio Controller (rev 30) (prog-if 80)
	Subsystem: ASUSTeK Computer Inc. Device 16a1
	Flags: bus master, fast devsel, latency 32, IRQ 145
	Memory at b4418000 (64-bit, non-prefetchable) [size=16K]
	Memory at b4100000 (64-bit, non-prefetchable) [size=1M]
	Capabilities: <access denied>
	Kernel driver in use: snd_hda_intel
	Kernel modules: snd_hda_intel, snd_soc_skl, snd_sof_pci_intel_cnl
00: 86 80 c8 9d 06 04 10 00 30 80 03 04 10 20 00 00
10: 04 80 41 b4 00 00 00 00 00 00 00 00 00 00 00 00
20: 04 00 10 b4 00 00 00 00 00 00 00 00 43 10 a1 16
30: 00 00 00 00 50 00 00 00 00 00 00 00 ff 01 00 00

00:1f.4 SMBus: Intel Corporation Cannon Point-LP SMBus Controller (rev 30)
	Subsystem: ASUSTeK Computer Inc. Device 16a1
	Flags: medium devsel, IRQ 16
	Memory at b4422000 (64-bit, non-prefetchable) [size=256]
	I/O ports at efa0 [size=32]
	Kernel driver in use: i801_smbus
	Kernel modules: i2c_i801
00: 86 80 a3 9d 03 00 80 02 30 00 05 0c 00 00 00 00
10: 04 20 42 b4 00 00 00 00 00 00 00 00 00 00 00 00
20: a1 ef 00 00 00 00 00 00 00 00 00 00 43 10 a1 16
30: 00 00 00 00 00 00 00 00 00 00 00 00 ff 01 00 00

00:1f.5 Serial bus controller [0c80]: Intel Corporation Cannon Point-LP SPI Controller (rev 30)
	Subsystem: Intel Corporation Device 7270
	Flags: fast devsel
	Memory at fe010000 (32-bit, non-prefetchable) [size=4K]
00: 86 80 a4 9d 02 04 00 00 30 00 80 0c 00 00 00 00
10: 00 00 01 fe 00 00 00 00 00 00 00 00 00 00 00 00
20: 00 00 00 00 00 00 00 00 00 00 00 00 86 80 70 72
30: 00 00 00 00 00 00 00 00 00 00 00 00 00 00 00 00

02:00.0 3D controller: NVIDIA Corporation GP108M [GeForce MX150] (rev a1)
	DeviceName: Second VGA
	Subsystem: ASUSTeK Computer Inc. Device 1d5e
	Flags: bus master, fast devsel, latency 0, IRQ 146
	Memory at b3000000 (32-bit, non-prefetchable) [size=16M]
	Memory at a0000000 (64-bit, prefetchable) [size=256M]
	Memory at b0000000 (64-bit, prefetchable) [size=32M]
	I/O ports at 3000 [size=128]
	Expansion ROM at b4000000 [virtual] [disabled] [size=512K]
	Capabilities: <access denied>
	Kernel driver in use: nvidia
	Kernel modules: nouveau, nvidia_drm, nvidia
00: de 10 12 1d 07 04 10 00 a1 00 02 03 00 00 00 00
10: 00 00 00 b3 0c 00 00 a0 00 00 00 00 0c 00 00 b0
20: 00 00 00 00 01 30 00 00 00 00 00 00 43 10 5e 1d
30: 00 00 00 00 60 00 00 00 00 00 00 00 ff 01 00 00

03:00.0 Unassigned class [ff00]: Realtek Semiconductor Co., Ltd. RTS522A PCI Express Card Reader (rev 01)
	DeviceName: Card Reader
	Subsystem: ASUSTeK Computer Inc. Device 202f
	Flags: bus master, fast devsel, latency 0, IRQ 136
	Memory at b4300000 (32-bit, non-prefetchable) [size=4K]
	Capabilities: <access denied>
	Kernel driver in use: rtsx_pci
	Kernel modules: rtsx_pci
00: ec 10 2a 52 06 04 10 00 01 00 00 ff 10 00 00 00
10: 00 00 30 b4 00 00 00 00 00 00 00 00 00 00 00 00
20: 00 00 00 00 00 00 00 00 00 00 00 00 43 10 2f 20
30: 00 00 00 00 40 00 00 00 00 00 00 00 ff 01 00 00

04:00.0 Non-Volatile memory controller: Toshiba Corporation Device 0116 (prog-if 02 [NVM Express])
	Subsystem: Toshiba Corporation Device 0001
	Flags: bus master, fast devsel, latency 0, IRQ 16, NUMA node 0
	Memory at b4200000 (64-bit, non-prefetchable) [size=16K]
	Capabilities: <access denied>
	Kernel driver in use: nvme
00: 79 11 16 01 06 04 10 00 00 02 08 01 10 00 00 00
10: 04 00 20 b4 00 00 00 00 00 00 00 00 00 00 00 00
20: 00 00 00 00 00 00 00 00 00 00 00 00 79 11 01 00
30: 00 00 00 00 40 00 00 00 00 00 00 00 ff 01 00 00

