00:00.0 Host bridge: Intel Corporation Xeon E3-1200 v5/E3-1500 v5/6th Gen Core Processor Host Bridge/DRAM Registers (rev 07)
00: 86 80 18 19 46 01 90 20 07 00 00 06 00 00 00 00
10: 00 00 00 00 00 00 00 00 00 00 00 00 00 00 00 00
20: 00 00 00 00 00 00 00 00 00 00 00 00 28 10 a5 06
30: 00 00 00 00 e0 00 00 00 00 00 00 00 00 00 00 00

00:01.0 PCI bridge: Intel Corporation 6th-10th Gen Core Processor PCIe Controller (x16) (rev 07)
00: 86 80 01 19 47 05 10 00 07 00 04 06 00 00 81 00
10: 00 00 00 00 00 00 00 00 00 01 01 00 f0 00 00 20
20: b0 92 f0 92 01 00 01 00 20 00 00 00 20 00 00 00
30: 00 00 00 00 88 00 00 00 00 00 00 00 ff 01 03 00

00:01.1 PCI bridge: Intel Corporation Xeon E3-1200 v5/E3-1500 v5/6th Gen Core Processor PCIe Controller (x8) (rev 07)
00: 86 80 05 19 47 05 10 00 07 00 04 06 00 00 81 00
10: 00 00 00 00 00 00 00 00 00 02 02 00 f0 00 00 00
20: f0 ff 00 00 f1 ff 01 00 00 00 00 00 00 00 00 00
30: 00 00 00 00 88 00 00 00 00 00 00 00 ff 01 03 00

00:14.0 USB controller: Intel Corporation 100 Series/C230 Series Chipset Family USB 3.0 xHCI Controller (rev 31)
00: 86 80 2f a1 46 05 90 02 31 30 03 0c 00 00 80 00
10: 04 00 00 93 00 00 00 00 00 00 00 00 00 00 00 00
20: 00 00 00 00 00 00 00 00 00 00 00 00 28 10 a5 06
30: 00 00 00 00 70 00 00 00 00 00 00 00 ff 01 00 00

00:14.2 Signal processing controller: Intel Corporation 100 Series/C230 Series Chipset Family Thermal Subsystem (rev 31)
00: 86 80 31 a1 06 01 10 00 31 00 80 11 00 00 00 00
10: 04 30 f0 ff 2f 00 00 00 00 00 00 00 00 00 00 00
20: 00 00 00 00 00 00 00 00 00 00 00 00 28 10 a5 06
30: 00 00 00 00 50 00 00 00 00 00 00 00 ff 03 00 00

00:16.0 Communication controller: Intel Corporation 100 Series/C230 Series Chipset Family MEI Controller #1 (rev 31)
00: 86 80 3a a1 00 00 10 00 31 00 80 07 00 00 80 00
10: 04 20 f0 ff 2f 00 00 00 00 00 00 00 00 00 00 00
20: 00 00 00 00 00 00 00 00 00 00 00 00 28 10 a5 06
30: 00 00 00 00 50 00 00 00 00 00 00 00 ff 01 00 00

00:16.1 Communication controller: Intel Corporation 100 Series/C230 Series Chipset Family MEI Controller #2 (rev 31)
00: 86 80 3b a1 06 00 10 00 31 00 80 07 00 00 80 00
10: 04 10 f0 ff 2f 00 00 00 00 00 00 00 00 00 00 00
20: 00 00 00 00 00 00 00 00 00 00 00 00 28 10 a5 06
30: 00 00 00 00 50 00 00 00 00 00 00 00 ff 01 00 00

00:17.0 SATA controller: Intel Corporation Q170/Q150/B150/H170/H110/Z170/CM236 Chipset SATA Controller [AHCI Mode] (rev 31)
00: 86 80 02 a1 47 05 b0 02 31 01 06 01 00 00 00 00
10: 00 40 01 93 00 70 01 93 41 30 00 00 49 30 00 00
20: 21 30 00 00 00 60 01 93 00 00 00 00 28 10 a5 06
30: 00 00 00 00 80 00 00 00 00 00 00 00 ff 01 00 00

00:1d.0 PCI bridge: Intel Corporation 100 Series/C230 Series Chipset Family PCI Express Root Port #9 (rev f1)
00: 86 80 18 a1 47 05 10 00 f1 00 04 06 00 00 81 00
10: 00 00 00 00 00 00 00 00 00 03 03 00 f0 00 00 20
20: 10 90 10 90 a1 92 a1 92 00 00 00 00 00 00 00 00
30: 00 00 00 00 40 00 00 00 00 00 00 00 ff 01 03 00

00:1d.2 PCI bridge: Intel Corporation 100 Series/C230 Series Chipset Family PCI Express Root Port #11 (rev f1)
00: 86 80 1a a1 47 05 10 00 f1 00 04 06 00 00 81 00
10: 00 00 00 00 00 00 00 00 00 04 08 00 f0 00 00 20
20: 00 92 90 92 01 91 f1 91 00 00 00 00 00 00 00 00
30: 00 00 00 00 40 00 00 00 00 00 00 00 ff 03 1b 00

00:1f.0 ISA bridge: Intel Corporation C236 Chipset LPC/eSPI Controller (rev 31)
00: 86 80 49 a1 47 01 00 02 31 00 01 06 00 00 80 00
10: 00 00 00 00 00 00 00 00 00 00 00 00 00 00 00 00
20: 00 00 00 00 00 00 00 00 00 00 00 00 28 10 a5 06
30: 00 00 00 00 00 00 00 00 00 00 00 00 00 00 00 00

00:1f.2 Memory controller: Intel Corporation 100 Series/C230 Series Chipset Family Power Management Controller (rev 31)
00: 86 80 21 a1 06 00 00 00 31 00 80 05 00 00 80 00
10: 00 00 01 93 00 00 00 00 00 00 00 00 00 00 00 00
20: 00 00 00 00 00 00 00 00 00 00 00 00 28 10 a5 06
30: 00 00 00 00 00 00 00 00 00 00 00 00 00 00 00 00

00:1f.4 SMBus: Intel Corporation 100 Series/C230 Series Chipset Family SMBus (rev 31)
00: 86 80 23 a1 43 01 80 02 31 00 05 0c 00 00 00 00
10: 04 00 f0 ff 2f 00 00 00 00 00 00 00 00 00 00 00
20: a1 ef 00 00 00 00 00 00 00 00 00 00 28 10 a5 06
30: 00 00 00 00 00 00 00 00 00 00 00 00 ff 01 00 00

01:00.0 Ethernet controller: Intel Corporation I350 Gigabit Network Connection (rev 01)
00: 86 80 21 15 06 04 10 00 01 00 00 02 20 00 80 00
10: 00 00 e0 92 00 00 00 00 00 00 00 00 00 c0 f0 92
20: 00 00 00 00 00 00 00 00 00 00 00 00 86 80 01 50
30: 00 00 f8 ff 40 00 00 00 00 00 00 00 ff 01 00 00

01:00.1 Ethernet controller: Intel Corporation I350 Gigabit Network Connection (rev 01)
00: 86 80 21 15 06 04 10 00 01 00 00 02 20 00 80 00
10: 00 00 d0 92 00 00 00 00 00 00 00 00 00 80 f0 92
20: 00 00 00 00 00 00 00 00 00 00 00 00 86 80 01 50
30: 00 00 f8 ff 40 00 00 00 00 00 00 00 ff 02 00 00

01:00.2 Ethernet controller: Intel Corporation I350 Gigabit Network Connection (rev 01)
00: 86 80 21 15 06 04 10 00 01 00 00 02 20 00 80 00
10: 00 00 c0 92 00 00 00 00 00 00 00 00 00 40 f0 92
20: 00 00 00 00 00 00 00 00 00 00 00 00 86 80 01 50
30: 00 00 f8 ff 40 00 00 00 00 00 00 00 ff 03 00 00

01:00.3 Ethernet controller: Intel Corporation I350 Gigabit Network Connection (rev 01)
00: 86 80 21 15 06 04 10 00 01 00 00 02 20 00 80 00
10: 00 00 b0 92 00 00 00 00 00 00 00 00 00 00 f0 92
20: 00 00 00 00 00 00 00 00 00 00 00 00 86 80 01 50
30: 00 00 f8 ff 40 00 00 00 00 00 00 00 ff 04 00 00

03:00.0 Ethernet controller: Broadcom Inc. and subsidiaries NetXtreme BCM5720 2-port Gigabit Ethernet PCIe
00: e4 14 5f 16 06 04 10 00 00 00 00 02 00 00 80 00
10: 0c 00 a3 92 00 00 00 00 0c 00 a4 92 00 00 00 00
20: 0c 00 a5 92 00 00 00 00 00 00 00 00 28 10 a5 06
30: 00 00 fc ff 48 00 00 00 00 00 00 00 ff 01 00 00

03:00.1 Ethernet controller: Broadcom Inc. and subsidiaries NetXtreme BCM5720 2-port Gigabit Ethernet PCIe
00: e4 14 5f 16 06 04 10 00 00 00 00 02 00 00 80 00
10: 0c 00 a0 92 00 00 00 00 0c 00 a1 92 00 00 00 00
20: 0c 00 a2 92 00 00 00 00 00 00 00 00 28 10 a5 06
30: 00 00 fc ff 48 00 00 00 00 00 00 00 ff 02 00 00

04:00.0 PCI bridge: Renesas Technology Corp. SH7758 PCIe Switch [PS]
00: 12 19 1d 00 07 04 10 00 00 00 04 06 00 00 01 80
10: 00 00 00 00 00 00 00 00 04 05 08 00 f1 01 00 00
20: 00 92 90 92 01 91 f1 91 00 00 00 00 00 00 00 00
30: 00 00 00 00 40 00 00 00 00 00 00 00 ff 00 1b 00

05:00.0 PCI bridge: Renesas Technology Corp. SH7758 PCIe Switch [PS]
00: 12 19 1d 00 07 04 10 00 00 00 04 06 00 00 01 80
10: 00 00 00 00 00 00 00 00 05 06 07 00 f1 01 00 00
20: 00 92 80 92 01 91 f1 91 00 00 00 00 00 00 00 00
30: 00 00 00 00 40 00 00 00 00 00 00 00 ff 00 1b 00

06:00.0 PCI bridge: Renesas Technology Corp. SH7758 PCIe-PCI Bridge [PPB]
00: 12 19 1a 00 07 00 10 00 00 00 04 06 00 00 01 80
10: 00 00 00 00 00 00 00 00 06 07 07 00 f1 01 00 20
20: 00 92 80 92 01 91 f1 91 00 00 00 00 00 00 00 00
30: 00 00 00 00 40 00 00 00 00 00 00 00 ff 00 1b 00

07:00.0 VGA compatible controller: Matrox Electronics Systems Ltd. G200eR2 (rev 01)
00: 2b 10 34 05 07 00 90 02 01 00 00 03 00 40 00 00
10: 08 00 00 91 00 00 80 92 00 00 00 92 00 00 00 00
20: 00 00 00 00 00 00 00 00 00 00 00 00 28 10 a5 06
30: 00 00 00 00 dc 00 00 00 00 00 00 00 ff 01 10 20

